id_nombre,nombre,direccion,id_ciudad,ciudad,codigo_postal,latitud,longitud,puntuacion_yelp,categories,puntuacion_usuarios,anio,analisis_sentimientos
7b24,Julian's Little Italy,916-A Patricia Ave,L2T6,Dunedin,34698,28.016453,-82.776384,4.0,"Italian, Pizza, Restaurants",4.2,2019,1.0
7b75,The New York Diner,2126 Jelane Dr,HGEX,Valrico,33596,27.9384025,-82.2507677,4.0,"Diners, Bed & Breakfast, Hotels & Travel, Restaurants",3.0,2019,1.0
7b96,Sneaky's Sports Bar & Grill,7500 Ulmerton Rd,LIFE,Largo,33778,27.893629,-82.742307,3.0,"Restaurants, Bars, Music Venues, Arts & Entertainment, Beer Bar, Nightlife, Sports Bars, American (Traditional), American (New)",2.0,2019,1.0
7bc5,Jon Smith Subs,"17791 State Road 54, Ste 104",1GQ7,Lutz,33559,28.1953726698,-82.5219116817,4.0,"Sandwiches, Restaurants, Delis",3.9,2019,1.0
7bcd,R Beach,4054 Shoal Line Blvd,I0WF,Spring Hill,34610,28.4876983,-82.6500308,4.0,"Restaurants, American (New)",4.0,2019,1.0
7bd7,Let Them Eat Cake,"3805 S West Shore Blvd, Ste B",RGTW,Tampa,33664,27.9083039,-82.5272462,3.5,"Food, Bakeries, Restaurants",4.0,2019,1.0
7bdc,Cepas Wine and Tapas Bar,5350 W Village Dr,RGTW,Tampa,33664,28.0817346652,-82.539145276,4.0,"Tapas Bars, Wine Bars, Bars, Beer, Wine & Spirits, Nightlife, Restaurants, Food",4.8,2019,1.0
7be7,The Latin Spot,19017 US-41,1GQ7,Lutz,33559,28.151363837,-82.4612581387,3.5,"Food, Restaurants, Caribbean, Latin American, Caterers, Dominican, Coffee & Tea, Sandwiches, Event Planning & Services",3.7,2019,1.0
7be9,Bizou Brasserie,601 N Florida Ave,RGTW,Tampa,33664,27.9501175026,-82.45749393,3.5,"Bars, American (New), Restaurants, Breakfast & Brunch, French, Brasseries, Nightlife",3.3,2019,1.0
7bf1,Lucky Dill Deli,33180 US 19 N,IKXB,Palm Harbor,34685,28.0739331799,-82.7397437681,3.5,"Coffee & Tea, Restaurants, Desserts, Food, American (New), Sandwiches, Breakfast & Brunch, Delis",3.6,2019,1.0
7bfc,La Teresita Grocery,3302 W Columbus Dr,RGTW,Tampa,33664,27.9662314,-82.4977866,4.5,"Food, Spanish, Grocery, Restaurants, Cuban",4.3,2019,1.0
7c36,Dragon Fire Grill,3426 East Busch Blvd,RGTW,Tampa,33664,28.0373205043,-82.4229719995,3.0,"Restaurants, Food Court, Arts & Entertainment",2.5,2019,1.0
7c41,Nature's Cafe & Pantry,"5831 Memorial Hwy, Ste A",RGTW,Tampa,33664,27.9845472,-82.5688359,4.5,"Seafood, American (New), Mexican, Restaurants, Tacos",4.4,2019,1.0
7c49,Empanada World,4123 Henderson Blvd,RGTW,Tampa,33664,27.9275591359,-82.5134054571,4.5,"Restaurants, Latin American, Ethnic Food, Specialty Food, Food, Empanadas",5.0,2019,1.0
7c57,Noodle Kitchen and Market,500 S Howard Ave,RGTW,Tampa,33664,27.9394321546,-82.4827355146,4.5,"Pan Asian, Noodles, Asian Fusion, Restaurants, Vegetarian, Food, Thai, Specialty Food, Food Delivery Services",4.3,2019,1.0
7c8d,The Corner Family Restaurant,3525 US Hwy 19,3IHW,New Port Richey,34655,28.214337,-82.742021,3.5,"Burgers, Restaurants, Waffles, American (Traditional), Breakfast & Brunch",4.3,2019,1.0
7c96,Down By The Bay Cafe,11720 US Hwy 19,9LT4,Port Richey,34668,28.3274575419,-82.6984089,4.5,"Restaurants, Seafood, American (Traditional), Greek, Breakfast & Brunch",4.3,2019,1.0
7cc2,A & N Italian Deli,17956 US Hwy 19 N,MCCU,Clearwater,33769,27.9360575066,-82.730962851,4.5,"Sandwiches, Delis, Restaurants, Italian",4.8,2019,1.0
7cca,Carmelitas,8526 Old County Rd 54,3IHW,New Port Richey,34655,28.2163047,-82.6740179,3.5,"Restaurants, Mexican",3.1,2019,1.0
7cd3,Bel Mar Tavern,4328 W El Prado Blvd,RGTW,Tampa,33664,27.9113849,-82.5175863,4.0,"Sports Bars, American (New), Bars, Nightlife, Restaurants, Beer Bar",1.0,2019,0.5
7cd4,Bern's Steak House,1208 S Howard Ave,RGTW,Tampa,33664,27.9318624,-82.4827004,4.5,"Arts & Entertainment, Steakhouses, Restaurants",4.0,2019,1.0
7ce8,Cosmic Donuts,32130 US Hwy 19 N,IKXB,Palm Harbor,34685,28.064351,-82.739519,4.0,"Breakfast & Brunch, Food, Burgers, Coffee & Tea, Restaurants, Donuts",3.5,2019,1.0
7cf5,Fresh Market of Hyde Park,742 S Village Cir,RGTW,Tampa,33664,27.9364549,-82.475193,5.0,"Local Flavor, Organic Stores, Food, Specialty Food, Fruits & Veggies, Farmers Market, Vegan, Restaurants",5.0,2019,1.0
7cfc,Tampa Pizza Company,777 N Ashley Dr,RGTW,Tampa,33664,27.94501128481064,-82.47124296444044,3.8,"Pizza, Restaurants, Vegetarian, Gluten-Free",3.5,2019,1.0
7d42,Crispers,11019 Causeway Blvd,W2W7,Brandon,33511,27.93478619490714,-82.34096142975,3.0,"Soup, American (New), Restaurants, Salad, Food, Sandwiches",3.7,2019,1.0
7d65,Taco Holic,500 N Florida Ave,RGTW,Tampa,33664,27.949034892600004,-82.4578865534,3.5,"Tacos, Food Trucks, Mexican, Food, Restaurants",4.4,2019,0.5
7d7c,The Press Box,222 S Dale Mabry Hwy,RGTW,Tampa,33664,27.94236,-82.5051469,3.5,"American (Traditional), Nightlife, Sports Bars, Bars, Restaurants",3.2,2019,1.0
7d89,The Colonnade Restaurant,3401 Bayshore Bvld,RGTW,Tampa,33664,27.9123133,-82.4916655,3.0,"Seafood, American (New), Restaurants",3.0,2019,1.0
7d8f,RJ's Wild Wild Wings,5130 Gall Blvd,PM56,Zephyrhills,33542,28.2324992,-82.180583,2.5,"Bars, Food, American (Traditional), Restaurants, Chicken Wings, Sports Bars, Nightlife",2.0,2019,0.5
7dbe,San Antonio Restaurant,32625 State Rd 52,DE2U,San Antonio,33576,28.3321286294,-82.2761303887,4.0,"Dive Bars, Bars, Nightlife, Restaurants, American (Traditional)",3.0,2019,1.0
7dc0,Trip's Diner,10555 Park Blvd,8ZKX,Seminole,33777,27.807192990030376,-82.68697155666077,4.0,"Salad, Restaurants, Breakfast & Brunch, Diners, Burgers",4.2,2019,1.0
7dd3,Japanese Kitchen Dosunco,3310 W Kennedy Blvd,RGTW,Tampa,33664,27.944389,-82.497961,4.0,"Japanese, Food, Tapas/Small Plates, Izakaya, Restaurants, Specialty Food, Ramen, Ethnic Food",4.1,2019,1.0
7df8,GUAC Tequila & Tacos,"4110 Henderson Blvd, Ste B",RGTW,Tampa,33664,27.9273597,-82.5125375,3.5,"Tex-Mex, Mexican, Restaurants",3.2,2019,1.0
7e05,Green Light Bar,229 62nd Ave N,9EV3,San Petersburgo,33730,27.8288083,-82.6366913,4.0,"Bars, Nightlife, Restaurants, Sushi Bars, Food, Coffee & Tea",4.1,2019,1.0
7e22,The Avenue DTSP,330 1st Ave S,9EV3,San Petersburgo,33730,27.770057,-82.637674,3.5,"Dive Bars, Burgers, Cocktail Bars, American (Traditional), American (New), Bars, Restaurants, Nightlife",3.6,2019,1.0
7e40,Marguerite's Cafe & Catering,405 Plaza Dr,L2T6,Dunedin,34698,28.0016118253,-82.7872688101,4.0,"Restaurants, Cafes, Breakfast & Brunch, Sandwiches, Caterers, American (Traditional), Event Planning & Services",4.0,2019,1.0
7e4a,Cafe Masala,10324 Roosevelt Blvd N,9EV3,San Petersburgo,33730,27.8658632,-82.6428412,4.5,"Indian, Restaurants, Food, Specialty Food",4.0,2019,1.0
7e54,Chismis & co,1910 N Ola Ave,RGTW,Tampa,33664,27.9611064,-82.4640636,4.5,"Restaurants, Filipino",4.0,2019,0.5
7e60,Vale Food Co,501 N Franklin St,RGTW,Tampa,33664,27.9486611,-82.4581385,3.5,"Acai Bowls, Food Delivery Services, Salad, Poke, Juice Bars & Smoothies, American (Traditional), Food, American (New), Restaurants",3.5,2019,1.0
7e69,China Wok,"4058 Fiesta Plz, Ste 104",RGTW,Tampa,33664,27.973195632985583,-82.58352940755945,3.7,"Cantonese, Restaurants, Chinese",3.7,2019,1.0
7e6d,Perdigon El Sabor,"8548 N Dale Mabry Hwy, Ste 1A",RGTW,Tampa,33664,28.01455016,-82.50930654,3.9,"Restaurants, Filipino, Mexican, Steakhouses, Tacos, Salad, Venezuelan, Latin American",4.3,2019,1.0
7e87,Caribbean Sandwich Shop,8240 W Waters Ave,RGTW,Tampa,33664,28.0255061,-82.5737261,4.5,"Caribbean, Restaurants, Sandwiches",3.7,2019,1.0
7eb7,The Cheesecake Factory,"2223 N West Shore Blvd, Ste B201, International Plaza",RGTW,Tampa,33664,27.95218345474754,-82.4475128190459,3.5,"Salad, Desserts, Food, Restaurants, American (Traditional), American (New), Seafood",3.4,2019,1.0
7eb9,Argento's Italian Bistro,10042 US Hwy 19,9LT4,Port Richey,34668,28.30521757735849,-82.70198820754717,4.5,"Caterers, Event Planning & Services, Italian, Restaurants, Bakeries, Food",4.3,2019,1.0
7ecb,Surf and Turf Cafe,101 N Franklin St,RGTW,Tampa,33664,27.9456571,-82.4567437,3.0,"Seafood, Restaurants, Sandwiches",3.0,2019,1.0
7ed7,Gran Agave,5924 Providence Rd,TC12,Riverview,33579,27.8944444366,-82.3180296645,3.5,"Restaurants, Mexican",3.8,2019,1.0
7edb,365 Caffe Italiano,"28210 Paseo Dr, Ste 100, Shops At Wiregrass",CQ72,Wesley Chapel,33545,28.187946572,-82.35005583850001,4.5,"Breakfast & Brunch, Coffee & Tea, Food, Ice Cream & Frozen Yogurt, Creperies, Gelato, Comfort Food, Sandwiches, Restaurants, Cafes",4.4,2019,1.0
7ef9,Rum River Bar & Grill,7811 Bayview St,9LT4,Port Richey,34668,28.270352,-82.725628,3.0,"Nightlife, Food, American (New), Beer, Wine & Spirits, Bars, Restaurants",3.2,2019,1.0
7f01,The Stone Soup Company,1919 E 7th Ave,RGTW,Tampa,33664,27.9600749,-82.4372231,4.0,"Soup, Restaurants, Cuban, Sandwiches",3.7,2019,1.0
7f22,Sassy Angels Hair Salon,4002 E Palifox St,RGTW,Tampa,33664,27.9875296,-82.4138377,4.0,"Restaurants, Beauty & Spas, Hair Salons",5.0,2019,1.0
7f27,El Huarache Azteca Restaurant,2908 Roosevelt Blvd,MCCU,Clearwater,33769,27.91686,-82.717372,4.0,"Restaurants, Soup, Mexican, Salad",5.0,2019,1.0
7f3d,Asiana Bistro,228 Oakfield Dr,W2W7,Brandon,33511,27.9345337,-82.2880133,4.5,"Thai, Japanese, Chinese, Restaurants, Asian Fusion",3.0,2019,0.5
7f40,Joey's New York Pizza and Italian Restaurant,9830 Little Rd,3IHW,New Port Richey,34655,28.19057959058824,-82.71483803764706,3.6,"Pizza, Italian, Food, Restaurants",3.7,2019,1.0
7f4f,WaterWorks Bar and Grill,111 W Fortune St,RGTW,Tampa,33664,27.9530053,-82.463979,3.0,"Bars, Hotels & Travel, Buffets, Nightlife, American (New), Restaurants, Salad",2.8,2019,0.5
7f5c,Habibi Cafe and Hookah Bar,1632 E 7th Ave,RGTW,Tampa,33664,27.9604396,-82.4405791,3.0,"Restaurants, Bars, Cafes, Hookah Bars, Nightlife",3.0,2019,0.5
7f74,La Pequeña Colombia,6312 N Armenia Ave,RGTW,Tampa,33664,28.004715000000004,-82.4847094,4.0,"Food, Restaurants, Colombian, Empanadas, Latin American, Venues & Event Spaces, Bars, Event Planning & Services, Nightlife",3.6,2019,1.0
7f75,Bavaro's Pizza Napoletana & Pastaria,514 N Franklin St,RGTW,Tampa,33664,27.91111791719457,-82.5319426036199,4.0,"Italian, Restaurants, Pizza",3.9,2019,1.0
7f7b,PDQ Waters,5706 W Waters Ave,RGTW,Tampa,33664,28.0232034629,-82.54192108302144,4.0,"Food, American (New), Restaurants, Coffee & Tea, Sandwiches, Chicken Shop, Fast Food, Salad",4.0,2019,1.0
7f97,Precinct Pizza,"10970 Cross Creek Blvd, Ste A",RGTW,Tampa,33664,28.1453504,-82.2819637,3.0,"Chicken Wings, Burgers, Restaurants, Pizza, Salad",2.5,2019,1.0
7fc0,Tasty Venues,951 E Brandon Blvd,W2W7,Brandon,33511,27.9371711,-82.2698738,4.5,"Hotels & Travel, Food Tours, Cooking Classes, Arts & Crafts, Home & Garden, Restaurants, Cafes, Shopping, Home Decor, American (New), Tours",5.0,2019,1.0
7fcb,Shep's Food Mart,2001 4th St N,9EV3,San Petersburgo,33730,27.7909036,-82.6382366,4.5,"Grocery, Delis, Food, Beer, Wine & Spirits, Restaurants",4.0,2019,0.5
7fee,The Olde Heights Bistro,4703 N Nebraska Ave,RGTW,Tampa,33664,27.9881518,-82.4509242,4.0,"Wine Bars, Sandwiches, Restaurants, Japanese, Nightlife, Bars, Tapas/Small Plates, Sushi Bars, American (New)",4.2,2019,1.0
802a,Cuban Breezes,13980 W Hillsborough Ave,RGTW,Tampa,33664,28.0325013002,-82.6474187391,4.0,"Restaurants, Cuban",4.1,2019,1.0
8032,Cooper's Hawk Winery & Restaurants - Tampa,4110 W Boy Scout Blvd,RGTW,Tampa,33664,27.965418400000004,-82.512508,4.0,"Event Planning & Services, American (Traditional), Nightlife, Restaurants, Bars, Wineries, American (New), Wine Tasting Room, Gluten-Free, Arts & Entertainment, Party & Event Planning, Wine Bars, Food, Seafood",4.1,2019,1.0
8038,Hilton Garden Inn Tampa Suncoast Parkway,2155 Northpointe Pkwy,1GQ7,Lutz,33559,28.1888110244,-82.5398862362,4.5,"Venues & Event Spaces, Event Planning & Services, Hotels, Hotels & Travel, Restaurants",4.7,2019,1.0
803b,Original Pinehurst Pub,"1422 Pinehurst Rd, Ste B",L2T6,Dunedin,34698,28.0243612,-82.7720201,2.5,"Sports Bars, Burgers, Restaurants, Nightlife, Bars",2.3,2019,1.0
8047,TacoSon,30056 Sr 54,CQ72,Wesley Chapel,33545,28.06520581891892,-82.37694343783782,4.4,"Mexican, Restaurants",3.9,2019,1.0
806f,Osteria Natalina,3215 S MacDill Ave,RGTW,Tampa,33664,27.916778999999995,-82.494288,4.5,"Italian, Restaurants",4.7,2019,1.0
8072,Mama's Soul Food Restaurant,3701 E Dr M L K Jr Blvd,RGTW,Tampa,33664,27.981229,-82.4180964,4.0,"Restaurants, Soul Food, Southern, Seafood",3.9,2019,1.0
807b,Soong Thai Pinellas Park,6527 Park Blvd N,SJ01,Pinellas Park,33782,27.8394649,-82.7268213,4.5,"Thai, Restaurants",4.6,2019,1.0
80cf,House of China,18463 N US Hwy 41,1GQ7,Lutz,33559,28.141219,-82.461505,4.5,"Restaurants, Chinese",4.4,2019,1.0
80d0,Poke Falls - Brandon,2102 W Brandon Blvd,W2W7,Brandon,33511,27.938554000000003,-82.3187779,4.5,"Vegan, Asian Fusion, Hawaiian, Restaurants",4.7,2019,1.0
80f0,Chronic Tacos,10420 N Dale Mabry Hwy,RGTW,Tampa,33664,28.0458,-82.505131,3.5,"Restaurants, Tapas/Small Plates, Gluten-Free, Mexican",3.7,2019,1.0
8102,Hooks Waterfront Bar and Grill,611 Destiny Dr,D8OX,Ruskin,33570,27.7295452,-82.4741228,3.0,"Nightlife, American (Traditional), Restaurants, Bars, Beer, Wine & Spirits, Food",2.8,2019,1.0
8106,Barnes and Noble,28152 Paseo Dr,CQ72,Wesley Chapel,33545,28.1871217549,-82.3503308721,3.5,"Cafes, Books, Mags, Music & Video, Coffee & Tea, Food, Restaurants, Shopping, Bookstores",4.0,2019,1.0
8110,Angie's Restaurant,725 Cleveland St,MCCU,Clearwater,33769,27.9654261,-82.796093,4.0,"Breakfast & Brunch, Restaurants",3.9,2019,1.0
8111,Brunchies - Lutz,24400 State Rd 54,1GQ7,Lutz,33559,28.185389179900003,-82.41300055560001,4.0,"Restaurants, Breakfast & Brunch, Coffee & Tea, Burgers, Food",4.2,2019,1.0
8118,Mainstay Tavern,1160 Gulf Blvd,MCCU,Clearwater,33769,27.9555691603,-82.8287486,3.5,"Restaurants, Nightlife, Bars, Sports Bars, American (Traditional), Pubs",3.0,2019,1.0
8147,Cafe Dufrain,707 Harbour Post Dr,RGTW,Tampa,33664,27.939717,-82.4518049,3.5,"Restaurants, Venues & Event Spaces, Event Planning & Services, Asian Fusion, American (New), Southern, Cafes",3.7,2019,1.0
815b,Alto Mare Fish Bar,"300 Beach Dr NE, Ste 124",9EV3,San Petersburgo,33730,27.7755012,-82.6328533,4.5,"Restaurants, Seafood",4.5,2019,1.0
815f,Planet Grilled Cheese - Countryside Mall -,"27001 US Hwy 19 N, Ste 2084",MCCU,Clearwater,33769,28.0176573868,-82.7328772033,3.5,"Restaurants, Juice Bars & Smoothies, Food, American (Traditional)",3.0,2019,1.0
8169,Rocket Tacos,8015 Citrus Park Town Center Mall,RGTW,Tampa,33664,28.0697316,-82.576807,2.5,"Mexican, Restaurants",2.7,2019,1.0
816c,Coyote Rojo # 4,5375 Spring Hill Dr,I0WF,Spring Hill,34610,28.4590619063,-82.6250218973,4.0,"Mexican, Restaurants",4.1,2019,1.0
816f,Yard of Ale Soho,406 S Howard Ave,RGTW,Tampa,33664,27.9405722,-82.4827532,3.0,"Beer, Wine & Spirits, Food, Pubs, Wine Bars, Restaurants, American (New), Bars, Nightlife, Beer Bar, Sports Bars",2.5,2019,1.0
8174,Cafe Polis,26 Hibiscus St,3IGC,Tarpon Springs,34689,28.146608,-82.7559103,5.0,"Restaurants, Breakfast & Brunch, Coffee & Tea, Food, Cafes",5.0,2019,1.0
81a6,Anderson Road Cafe,6002 Anderson Rd,RGTW,Tampa,33664,28.0022732,-82.5280031,4.0,"Breakfast & Brunch, Cafes, Restaurants",5.0,2019,1.0
81d1,Desi Tadka Indian Cuisine,"3780 Tampa Rd, Ste D2",96OP,Oldsmar,34677,28.042406,-82.677755,4.0,"Restaurants, Indian",4.5,2019,1.0
81eb,Varsity Club Sports Bar Clearwater,24091 US Highway 19 N,MCCU,Clearwater,33769,27.9910654209,-82.72877343,4.0,"Burgers, Bars, Cafes, Restaurants, Chicken Wings, Nightlife, Sports Bars, American (Traditional), American (New)",4.6,2019,1.0
8207,Trinity Cafe,2801 N Nebraska Ave,RGTW,Tampa,33664,27.967865,-82.450926,5.0,"Local Services, Restaurants, Community Service/Non-Profit, Food, Cafes",5.0,2019,1.0
8214,Bonnie's Breakfast and Lunch,"1714 County Rd 1, Ste 15",L2T6,Dunedin,34698,28.028939,-82.763201,4.5,"Breakfast & Brunch, Restaurants, Creperies, American (Traditional)",4.9,2019,1.0
8229,St. Pete Bagel Co,11987 Indian Rocks Rd,LIFE,Largo,33778,27.882699,-82.831938,4.0,"Restaurants, Donuts, Bagels, Cafes, Food, Sandwiches, Bakeries, Coffee & Tea",3.9,2019,1.0
8233,American Legion Post 275,360 Wilson St,L2T6,Dunedin,34698,28.023683200000004,-82.7883986,4.5,"Restaurants, Local Services, Public Services & Government, Community Service/Non-Profit",4.7,2019,1.0
823d,The Deck Bar & Grille,"5901 Sun Blvd, Ste 100B",9EV3,San Petersburgo,33730,27.7136143,-82.7146769,3.0,"Restaurants, Bars, American (New), Nightlife, American (Traditional), Pubs",3.2,2019,1.0
825c,Metro Deli,28100 US Highway 19 N,MCCU,Clearwater,33769,28.0281065,-82.7391664,4.0,"Sandwiches, Delis, Restaurants",4.5,2019,1.0
8265,Sushi Sho Rexley,214 2nd St N,9EV3,San Petersburgo,33730,27.7739625,-82.6357933,4.5,"Restaurants, Sushi Bars",4.6,2019,1.0
8282,Sandbar Grill,2602 Bayshore Blvd,L2T6,Dunedin,34698,28.0499496074,-82.7809771101,3.5,"Restaurants, Seafood",4.0,2019,1.0
82b1,The Hideaway Pizza Pub,3901 6th St S,9EV3,San Petersburgo,33730,27.733177000000005,-82.641124,3.5,"Nightlife, Pizza, Pubs, Bars, Restaurants",3.0,2019,1.0
82b6,Dharma Southern Kitchen,1910 N Ola Ave,RGTW,Tampa,33664,27.9611064,-82.4640636,4.5,"Vegetarian, Vegan, Restaurants, Southern",4.5,2019,1.0
82d2,Rouen Thai,3324 W Gandy Blvd,RGTW,Tampa,33664,27.8933512,-82.4995947,4.0,"Thai, Restaurants, Noodles, Soup",4.3,2019,1.0
82e2,Amici's Pizza and Pasta,"16132 Churchview Dr, Ste 115",BONO,Lithia,33547,27.8422032382,-82.2154730558,4.0,"Salad, Bars, Wine Bars, Italian, Pizza, Restaurants, Nightlife",3.7,2019,1.0
82f3,Brick House Tavern + Tap,1102 N Dale Mabry Hwy,RGTW,Tampa,33664,27.9530594577,-82.5062855333,3.5,"Restaurants, Burgers, American (Traditional), Bars, Pubs, Nightlife",3.5,2019,1.0
830a,Faceless Samurai,3428 Tampa Rd,IKXB,Palm Harbor,34685,28.0667459118,-82.7209995984,4.0,"Thai, Sushi Bars, Japanese, Restaurants",4.8,2019,1.0
831e,Craft Street Kitchen - Oldsmar,3153 Curlew Rd,96OP,Oldsmar,34677,28.049304,-82.700597,4.5,"Breakfast & Brunch, Restaurants, Beer Bar, Nightlife, Salad, Bars, Food, American (New), Cocktail Bars, Gastropubs",4.5,2019,1.0
8355,The Bungalow Tampa,2202 W Kennedy Blvd,RGTW,Tampa,33664,27.9445198,-82.4821729,3.0,"Seafood, American (New), Nightlife, Breakfast & Brunch, Sports Bars, Restaurants, Bars, Caribbean, Cuban",4.7,2019,1.0
8366,Barefoot Beach House,332 S Gulfview Blvd,MCCU,Clearwater,33769,27.972399000000003,-82.82998,3.5,"Hotels, Ice Cream & Frozen Yogurt, Coffee & Tea, Fish & Chips, Restaurants, Hotels & Travel, Event Planning & Services, Food",3.7,2019,1.0
8375,Little Caesars Pizza,10683 Big Bend Rd,TC12,Riverview,33579,28.044974851228574,-82.45308992181428,2.7,"Pizza, Restaurants",2.1,2019,1.0
839f,La Fiebre Del Sabor Criollo,6311 E Hillsborough,RGTW,Tampa,33664,27.99569,-82.383316,4.5,"Restaurants, Latin American, Puerto Rican, Food, Caribbean, Food Trucks",4.5,2019,1.0
83b9,Tara's Roti Shop,10006 N 30th St,RGTW,Tampa,33664,28.0402911,-82.4266172,3.5,"Caribbean, Restaurants, Imported Food, Ethnic Food, Food, Specialty Food",3.3,2019,1.0
83ba,Red Square Deli,"4023 W Waters Ave, Ste 12",RGTW,Tampa,33664,28.0258548,-82.5104233,5.0,"Food, Restaurants, Specialty Food, Russian",5.0,2019,1.0
83d3,Kelly Days Firehouse Tavern,1710 E 7th Ave,RGTW,Tampa,33664,27.9604839,-82.4400832,3.5,"Burgers, Bars, Cocktail Bars, Nightlife, Restaurants",3.8,2019,1.0
83da,Martha's Place,5202 N Nebraska Ave,RGTW,Tampa,33664,27.9944053,-82.4513474,3.5,"Diners, Restaurants",4.3,2019,1.0
83db,Smokin' Out,3333 US Hwy 19,DVM9,Holiday,34691,28.20766,-82.74047499999999,4.5,"American (Traditional), Barbeque, Restaurants, Southern",4.4,2019,1.0
83dd,EAST!,2701 E Fowler Ave,RGTW,Tampa,33664,28.0540355908,-82.4293069079,4.0,"Japanese, Bars, Nightlife, Asian Fusion, Sushi Bars, Pizza, Restaurants, Sports Bars",4.2,2019,1.0
83ec,Earl of Sandwich,"2223 Fc-206 International Mall Food Court N Westshore Blvd, International Mall Food Court",RGTW,Tampa,33664,27.95208813398261,-82.56475572602174,3.6,"Event Planning & Services, Restaurants, Food, Wraps, Caterers, Salad, Sandwiches, Food Delivery Services",3.1,2019,1.0
83f1,Pho Loc Tho,11262 Boyette Rd,TC12,Riverview,33579,27.8546246,-82.3157035,4.5,"Sandwiches, Noodles, Asian Fusion, Restaurants, Vietnamese, Gluten-Free, Soup",4.4,2019,1.0
83fe,Renée's Bistro,"4010 W Boy Scout Blvd, Ste 185",RGTW,Tampa,33664,27.9658616999,-82.5109032914,4.0,"Salad, Restaurants, Cafes, Burgers",5.0,2019,1.0
8400,Earlybird Dinner Theater,13555 49th St N,MCCU,Clearwater,33769,27.8954431966,-82.6997489996,4.5,"Cinema, Restaurants, Arts & Entertainment, Dinner Theater",5.0,2019,1.0
8408,Mott & Hester Deli,"1155 S Dale Mabry Hwy, Ste 10",RGTW,Tampa,33664,27.93243,-82.506687,4.0,"Restaurants, Delis",3.0,2019,1.0
840b,Clearwater Wine Bar & Bistro,482 Poinsettia Ave,EXHF,Clearwater Beach,33767,27.9815251,-82.8262496,4.5,"Bars, Wine Bars, American (New), Nightlife, Mexican, Mediterranean, Restaurants",4.4,2019,1.0
840e,Marino's Family Grille,5017  Gall Blvd,PM56,Zephyrhills,33542,28.230420400000003,-82.180346,4.0,"Breakfast & Brunch, American (Traditional), Diners, Restaurants, Soup",4.0,2019,1.0
8432,Varsity Club Sports Bar Trinity,3523 Little Rd,3IHW,New Port Richey,34655,28.2089519501,-82.6666717529,3.0,"Cafes, Restaurants, Food, Bars, American (New), Sports Bars, Nightlife, Pizza",2.6,2019,1.0
8449,Pachanga Arepa,1991 Drew St,MCCU,Clearwater,33769,27.9675072,-82.7549096,4.0,"Colombian, Restaurants, Latin American, Venezuelan",4.2,2019,1.0
8459,Thai Spice Restaurant,"2475 McMullen Booth Rd, Ste B",MCCU,Clearwater,33769,28.011366,-82.71115,4.0,"Thai, Restaurants",4.1,2019,1.0
849b,Taco de Oro,10002 No Florida Ave,RGTW,Tampa,33664,28.0403682349,-82.4598239735,4.5,"Tacos, Restaurants, Food, Mexican, Food Trucks",5.0,2019,1.0
84a0,Fushia Asian Bistro & Hot Pot Buffet,15317 Amberly Dr,RGTW,Tampa,33664,28.0892554,-82.40441180000002,4.0,"Hot Pot, Restaurants, Shanghainese, Dim Sum, Buffets, Chinese, Szechuan, Asian Fusion",4.4,2019,1.0
84ac,edison: food+drink lab,912 W Kennedy Blvd,RGTW,Tampa,33664,27.944244,-82.469306,4.0,"American (New), Restaurants, Wine Bars, Beer Bar, Bars, Nightlife",4.1,2019,1.0
84c2,Fruitwood Standup Market,2203 W Swann Ave,RGTW,Tampa,33664,27.937564,-82.4823188,4.5,"Sandwiches, Fast Food, Beverage Store, Food, Juice Bars & Smoothies, Coffee & Tea, Restaurants, Pizza, Cafes",4.7,2019,1.0
84e5,River's Edge,200 N Ashley Dr,RGTW,Tampa,33664,27.946133,-82.459523,3.5,"Restaurants, Cocktail Bars, American (New), Bars, Hotels & Travel, Tapas/Small Plates, Hotels, Event Planning & Services, Nightlife, Seafood",3.5,2019,1.0
84f7,Eddie & Sam's NY Pizza,203 E Twiggs St,RGTW,Tampa,33664,27.948891,-82.459164,4.5,"Salad, Food, Pizza, Restaurants, Desserts, Ice Cream & Frozen Yogurt, Gelato",4.4,2019,1.0
84f8,Pierogi Grill,1535 Gulf To Bay Blvd,MCCU,Clearwater,33769,27.9605077111,-82.7734411527,4.0,"Polish, American (Traditional), Sandwiches, Restaurants",3.9,2019,1.0
851a,808 Island Treats,138 Mariner Blvd,I0WF,Spring Hill,34610,28.434983,-82.5465144,5.0,"Shaved Ice, Food, Desserts, Hawaiian, Restaurants, Bubble Tea, Food Trucks",5.0,2019,1.0
8550,Mi Viejo,6002 N US Hwy 41,20PF,Apollo Beach,33572,27.76389,-82.39646299999998,4.5,"Cuban, Latin American, Sandwiches, Restaurants, Breakfast & Brunch, Desserts, Food",4.6,2019,1.0
857d,The Salad Shop,474 Poinsettia Ave,MCCU,Clearwater,33769,27.9812984,-82.826314,4.0,"Juice Bars & Smoothies, Salad, Desserts, Fast Food, Restaurants, Food",4.0,2019,1.0
8580,Central Park Family Restaurant,7657 State Rd 54,3IHW,New Port Richey,34655,28.2176518,-82.6873044,4.0,"Restaurants, Greek, Salad, American (Traditional), Breakfast & Brunch",3.8,2019,1.0
85b0,Penguin Pretzel Factory,4238 St Lawrence Dr,3IHW,New Port Richey,34655,28.220554,-82.667048,4.5,"Food, Sandwiches, Restaurants, Cafes, Desserts, American (New), Comfort Food, Pretzels",4.6,2019,1.0
85b6,Fairway Grille @ the Dunedin Golf Club,1050 Palm Blvd,L2T6,Dunedin,34698,28.0423253,-82.7773089,4.0,"American (New), Golf, Restaurants, Active Life",3.7,2019,1.0
85d4,Muzzie's Ice Cream & Sandwich Shop,700 S Pinellas Ave,3IGC,Tarpon Springs,34689,28.1403001,-82.757406,4.5,"American (Traditional), Ice Cream & Frozen Yogurt, Food, Sandwiches, Restaurants",5.0,2019,1.0
85ec,Bourbon on Main,6307 Grand Blvd,3IHW,New Port Richey,34655,28.250077987,-82.7197672427,3.5,"Seafood, Restaurants, Bars, Nightlife, American (New), Cajun/Creole",3.8,2019,1.0
85ee,Karma Spirits & Cafe,10511 Spring Hill Dr,I0WF,Spring Hill,34610,28.4610596,-82.5445174,3.5,"Nightlife, Restaurants, Tobacco Shops, Beer, Wine & Spirits, Bars, Burgers, Sports Bars, Food, Shopping",1.5,2019,1.0
85fe,Tropix Beach Bar,655 S Gulfview Blvd,EXHF,Clearwater Beach,33767,27.9664356,-82.8257535,3.5,"Restaurants, Local Flavor, Hot Dogs, Sandwiches, American (New), Nightlife, Tiki Bars, Seafood, Bars",4.2,2019,1.0
8612,Tijuana Flats,23100 SR 54,1GQ7,Lutz,33559,27.963623582157844,-82.54917802734069,3.7,"Mexican, Restaurants, Tex-Mex",3.8,2019,1.0
861b,Rodie's Restaurant & Pancake House,"2475 N McMullen Booth Rd, Ste F",MCCU,Clearwater,33769,28.011581,-82.711798,4.0,"Breakfast & Brunch, Restaurants, American (Traditional), Diners",4.1,2019,1.0
861d,JIMMY’S PLACE,11335 Starkey Rd,LIFE,Largo,33778,27.8764458,-82.7619668736,3.5,"Breakfast & Brunch, Greek, Restaurants, American (Traditional), Diners",3.6,2019,1.0
8633,Norma's,120 N Collins St,7QXG,Plant City,33567,28.016212215,-82.1232603863,4.5,"Caterers, Event Planning & Services, Restaurants, Cafes, Sandwiches, Breakfast & Brunch, Cuban, Food",4.7,2019,1.0
8635,Luckie B's,4351 4th St N,9EV3,San Petersburgo,33730,27.81175,-82.63796,3.0,"Barbeque, Restaurants",3.0,2019,1.0
863e,Tum Rub Thai,32716 US Hwy 19 N,IKXB,Palm Harbor,34685,28.0694373,-82.7409459,4.0,"Sushi Bars, Thai, Restaurants",3.3,2019,1.0
8648,Mori Sushi,1136 94th Ave N,9EV3,San Petersburgo,33730,27.8568449,-82.6495937,4.0,"Japanese, Restaurants, Sushi Bars, Steakhouses",3.1,2019,1.0
8671,Umami Sushi. Hibachi,"3942 Tyrone Blvd N, Ste D",9EV3,San Petersburgo,33730,27.807152,-82.7516829,4.5,"Sushi Bars, Nightlife, Restaurants, Cocktail Bars, Japanese, Asian Fusion, Bars",4.4,2019,1.0
