id_nombre,nombre,direccion,id_ciudad,ciudad,codigo_postal,latitud,longitud,puntuacion_yelp,categories,puntuacion_usuarios,anio,analisis_sentimientos
42c1,I Wanna Wok,3513 Universal Plz,RGTW,Tampa,33664,27.9940804,-82.50840732,3.9,"Restaurants, Food, Food Trucks, Asian Fusion",2.2,2019,0.5
42cc,I Thai Sushi Sport bars,1228 Cleveland St,MCCU,Clearwater,33769,27.965780265500005,-82.78635744009999,4.5,"Restaurants, Sushi Bars, Nightlife, Bars, Sports Bars, Asian Fusion, Thai",4.4,2019,1.0
42cd,Proino Breakfast Club,14400 Walsingham Rd,LIFE,Largo,33778,27.8801096,-82.8377777,4.0,"Breakfast & Brunch, Restaurants",4.0,2019,1.0
42df,Mr Empanada,10023 N Dale Mabry Hwy,RGTW,Tampa,33664,28.0396738612,-82.51964184922942,3.9,"Restaurants, Local Flavor, Latin American, Empanadas, Spanish, Food, Mexican",3.4,2019,1.0
42ed,City Subs and More,5446 Grand Blvd,3IHW,New Port Richey,34655,28.23828,-82.7199,4.5,"Salad, Restaurants, Sandwiches, Soup, Food",5.0,2019,1.0
42f0,Happy Cactus Mexican Cocina,"2676 Bayshore Blvd, Ste H",L2T6,Dunedin,34698,28.0511835262,-82.7803348274,4.5,"Restaurants, Latin American, Mexican, Tacos",4.2,2019,1.0
42fa,Cafe Caribe,10422 N Dale Mabry Hwy,RGTW,Tampa,33664,28.04592,-82.505245,4.0,"Restaurants, Sandwiches, Breakfast & Brunch, Cuban, Cafes",4.2,2019,1.0
4300,Athens Restaurant,226 Main St,B8F4,Safety Harbor,34695,27.9906504,-82.6894764,4.0,"Greek, Restaurants, Breakfast & Brunch",4.4,2019,1.0
432e,Pizza Hut,8070 49th St Units 23,SJ01,Pinellas Park,33782,27.97637538448881,-82.51094491796923,2.0,"Chicken Wings, Pizza, Restaurants, Italian, Fast Food",2.1,2019,0.5
433d,Timpano Hyde Park,1610 W Swann Ave,RGTW,Tampa,33664,27.9370426822,-82.4760082753,3.5,"Music Venues, Bars, Restaurants, Italian, Steakhouses, Nightlife, Arts & Entertainment, Cocktail Bars",3.6,2019,1.0
4342,Maple Street Biscuit Company - Seminole City,"7756 113th St N, Ste E",8ZKX,Seminole,33777,27.843076,-82.793212,4.0,"Breakfast & Brunch, Southern, Restaurants, Comfort Food",3.9,2019,1.0
4351,Seminole Hard Rock Hotel & Casino Tampa,5223 Orient Rd,RGTW,Tampa,33664,27.993551,-82.371017,2.5,"Food, Hotels, Coffee & Tea, Hotels & Travel, Restaurants, Casinos, Burgers, Bars, Nightlife, Arts & Entertainment, Event Planning & Services",2.8,2019,1.0
435a,Bubba's 33,26340 Silver Maple Pkwy,CQ72,Wesley Chapel,33545,28.1914291434,-82.380725,4.0,"American (Traditional), Restaurants",3.7,2019,1.0
435c,OLIVIA,3601 W Swann Ave,RGTW,Tampa,33664,27.9377725,-82.5019869,4.5,"Desserts, Bars, Food, Nightlife, Italian, Restaurants",4.3,2019,1.0
4385,Michael's Deli & Produce,3602 Grand Blvd,3IHW,New Port Richey,34655,28.2113026,-82.723275,4.5,"International Grocery, Delis, Food, Restaurants, Ethnic Grocery",5.0,2019,1.0
438a,Poke' Cafe',1289 San Christopher Dr,L2T6,Dunedin,34698,28.019746000000005,-82.7742533,4.5,"Food, Restaurants, Seafood, Poke, Hawaiian, Sushi Bars",3.4,2019,1.0
4398,Petra Express Mediterranean Cuisine,17503 Preserve Walk Ln,RGTW,Tampa,33664,28.128048199999995,-82.3694399,4.0,"Restaurants, Mediterranean",4.5,2019,1.0
43a5,Sips Specialty Coffee House,6118 Gunn Hwy,RGTW,Tampa,33664,28.0632446,-82.5503918,4.5,"Coffee & Tea, Food, Internet Cafes, Cafes, Restaurants",4.9,2019,1.0
43cc,Tally Ho Bar & Grille,"7402 N 56th St, Ste 902",RGTW,Tampa,33664,28.0137283,-82.3939075,2.5,"Pubs, Bars, Chinese, Beer, Wine & Spirits, Nightlife, Sandwiches, Food, Restaurants, American (New)",4.3,2019,1.0
43ce,Ranchero Tacos,4901 N Florida Ave,RGTW,Tampa,33664,27.9907772752,-82.4592567823,5.0,"Mexican, Restaurants, Food, Tacos, Food Trucks",4.5,2019,1.0
43f2,Whole Note Acres,7324 Massachusetts Ave,3IHW,New Port Richey,34655,28.25834,-82.6933353,4.5,"Breakfast & Brunch, Restaurants",5.0,2019,1.0
43f3,Gil & Rick's Sports Bar & Pizzeria,1250 Seminole Blvd,LIFE,Largo,33778,27.9045049,-82.7877166,3.0,"Event Planning & Services, Bars, Sports Bars, Nightlife, Pizza, Venues & Event Spaces, Restaurants",3.8,2019,1.0
4422,Nico's Cheesesteak Factory & Pizzeria,5830 Gall Blvd,PM56,Zephyrhills,33542,28.2423027,-82.1865094,4.5,"Restaurants, Cheesesteaks",4.3,2019,1.0
4428,The Big Easy,1704 7th Ave,RGTW,Tampa,33664,27.9604176117,-82.4403327749,4.0,"Nightlife, Burgers, Cajun/Creole, Pubs, Beer, Wine & Spirits, American (New), Food, Bars, American (Traditional), Restaurants, Cocktail Bars, Comfort Food",3.6,2019,1.0
4439,Rice Bowl,"3244 Lithia Pinecrest Rd, Ste 101",HGEX,Valrico,33596,27.8945887,-82.2469271,4.5,"Thai, Sushi Bars, Asian Fusion, Restaurants, Vegetarian, Noodles",3.7,2019,1.0
4448,Cielito Lindo,5919 W Linebauh Ave,RGTW,Tampa,33664,28.0405005,-82.541411,4.5,"Restaurants, Food, Mexican, Food Trucks",5.0,2019,1.0
4461,Whiskey Joe's Bar & Grill - Port Richey,7835 Bayview St,9LT4,Port Richey,34668,28.2712783094,-82.7257485671,3.5,"Tiki Bars, Armenian, Restaurants, Burgers, American (New), Arts & Entertainment, Seafood, Event Planning & Services, Cocktail Bars, Music Venues, Bars, Nightlife, Venues & Event Spaces",3.5,2019,1.0
446b,Walk-On's Sports Bistreaux - Wesley Chapel Restaurant,25372 Sierra Center Blvd,1GQ7,Lutz,33559,28.1925675839,-82.3959063731,4.0,"American (Traditional), Restaurants, Sports Bars, Bars, Cajun/Creole, Nightlife",3.7,2019,1.0
4477,Hot Dogs on Main,505 Main St,L2T6,Dunedin,34698,28.0124356,-82.7855034,4.5,"Restaurants, Fast Food, Hot Dogs, Sandwiches",4.4,2019,1.0
4496,Starkey Pizza,12512 Starkey Rd,LIFE,Largo,33778,27.8860589,-82.7630514,4.0,"Sandwiches, Restaurants, Pizza, Italian",3.7,2019,1.0
449b,Marcellas Restaurant,1623 Gulf To Bay Blvd,MCCU,Clearwater,33769,27.960403,-82.769728,3.5,"Restaurants, Mexican",3.0,2019,1.0
44c6,Ho Choi Express,"2475 N McMullen Booth Rd, Ste A",MCCU,Clearwater,33769,28.0110154,-82.7106963,3.5,"Chinese, Restaurants, Party & Event Planning, Caterers, Event Planning & Services, Noodles",2.0,2019,0.5
44cc,Cali - Brandon,11230 Sullivan St,TC12,Riverview,33579,27.893116,-82.314543,4.5,"Gluten-Free, Breakfast & Brunch, Restaurants, American (New), Diners, Pizza",4.3,2019,1.0
44d2,Aguila Sandwich Shop,3200 W Hillsborough Ave,RGTW,Tampa,33664,27.9958661,-82.4946704,4.0,"Food, Breakfast & Brunch, Cuban, Restaurants, Sandwiches, Desserts",3.2,2019,1.0
44fe,Taqueria Viva Mexico,1740 Drew St,MCCU,Clearwater,33769,27.9682547,-82.7652794,4.5,"Restaurants, Mexican",5.0,2019,1.0
450a,Kazbors Grill & Bar,9992 US Hwy 301 S,TC12,Riverview,33579,27.8547222,-82.3261111,4.0,"Bars, Restaurants, American (Traditional), Cocktail Bars, Nightlife, Burgers",4.5,2019,1.0
453a,Popi's Place,1010 N US Hwy 41,D8OX,Ruskin,33570,27.7270445,-82.4341592,4.0,"Restaurants, Seafood, Breakfast & Brunch, American (New)",3.7,2019,1.0
455c,Acropolis Greek Taverna,3023 W Kennedy,RGTW,Tampa,33664,27.93456822329071,-82.4573917144071,3.7,"Greek, Restaurants, Nightlife, Mediterranean, Bars",3.7,2019,1.0
455e,Cafe Hey,1540 N Franklin St,RGTW,Tampa,33664,27.957238512,-82.4603595302,4.0,"Breakfast & Brunch, Local Flavor, Restaurants, Sandwiches, Food, Coffee & Tea",4.4,2019,1.0
458d,Zaytoon Grill,1618 Central Ave,9EV3,San Petersburgo,33730,27.7708578,-82.655347,4.5,"Mediterranean, Restaurants",4.4,2019,1.0
45a1,Song Huong Restaurant,4034 W Waters Ave,RGTW,Tampa,33664,28.14103991428572,-82.57861276428571,3.8,"Restaurants, Vietnamese",4.4,2019,1.0
45a4,MOSI Food Truck Rally,4801 East Fowler Ave,RGTW,Tampa,33664,28.0536294,-82.4044188,3.5,"Festivals, Arts & Entertainment, Local Flavor, Restaurants, Food Stands",1.0,2019,0.5
45ca,La Paisita Market,4966 US Hwy 19,3IHW,New Port Richey,34655,28.2313345,-82.729466,4.5,"Food, Colombian, Mexican, Restaurants, Grocery, Latin American",5.0,2019,1.0
45d1,Shang Hai Take Out,3337 S W Shore Blvd,RGTW,Tampa,33664,27.9143756,-82.5270909,4.0,"Food, Food Delivery Services, Fast Food, Restaurants, Chinese",4.0,2019,1.0
45d4,Giovanni's Fresh Kitchen,37611 US-19,IKXB,Palm Harbor,34685,28.114447939,-82.7391602844,4.5,"Nightlife, Bars, Cocktail Bars, Restaurants, Italian",4.3,2019,1.0
45ec,Estela's Family Cantina,5706 Main St,3IHW,New Port Richey,34655,28.2500853,-82.7201641,3.5,"Mexican, Restaurants, Seafood, Latin American",5.0,2019,1.0
45ee,Slice of Life Pizzeria,9123 Little Rd,3IHW,New Port Richey,34655,28.224234775000003,-82.55525156785714,3.1,"Restaurants, Pizza",3.2,2019,0.5
45f0,Hispania Tapas Bar & Cafe,34 N Ft Harrison Ave,MCCU,Clearwater,33769,27.9666149,-82.8001141,4.5,"Restaurants, Venues & Event Spaces, Food, Caterers, Event Planning & Services, Party & Event Planning, Art Galleries, Seafood, Tapas Bars, Food Delivery Services, Shopping, Spanish, Sandwiches, Arts & Entertainment, Vegan, Tapas/Small Plates",5.0,2019,1.0
45f3,Sakura Japanese Steak House and Sushi Bar,10722 Big Bend Rd,TC12,Riverview,33579,27.792806,-82.3308825,3.5,"Restaurants, Japanese, Asian Fusion, Steakhouses, Sushi Bars",3.3,2019,1.0
45f4,Armature Works,1910 N Ola Ave,RGTW,Tampa,33664,27.9612343316,-82.4637336883,4.5,"Specialty Food, Event Planning & Services, Food, Venues & Event Spaces, Real Estate, Restaurants, Southern, Food Court, Bars, Shared Office Spaces, Nightlife, Home Services",4.3,2019,1.0
460f,Seasons 52,204 N Westshore Blvd,RGTW,Tampa,33664,27.9463699545,-82.5248121533,4.0,"American (Traditional), Gluten-Free, Steakhouses, Wine Bars, Breakfast & Brunch, Nightlife, Vegetarian, Bars, Restaurants, Seafood, American (New)",4.2,2019,1.0
4625,Los Comparres,5305 N Armenia Ave,RGTW,Tampa,33664,27.995155,-82.48414,4.5,"Street Vendors, Restaurants, Mexican, Food Trucks, Food, Seafood",4.3,2019,1.0
462f,Tacos De Oro,2330 Willow Oak Dr,CQ72,Wesley Chapel,33545,28.1905149,-82.3774581,4.5,"Restaurants, Food Trucks, Food, Mexican, Tacos",4.5,2019,1.0
4634,Doc'S Grille,13050 Summerfield Blvd,TC12,Riverview,33579,27.7958206,-82.3172726,4.5,"Breakfast & Brunch, Restaurants, American (Traditional), Buffets",4.5,2019,1.0
463c,Wok Out Restaurant,"1444 S Belcher Rd, Ste B",MCCU,Clearwater,33769,27.9436939343,-82.7462848364,3.5,"Chinese, Restaurants",1.7,2019,0.5
4646,Johnny's pizza,6829 US Highway 19,3IHW,New Port Richey,34655,28.2568767,-82.7284226,4.0,"Restaurants, Pizza",5.0,2019,1.0
466c,Sip,6231 Grand Blvd,3IHW,New Port Richey,34655,28.249391,-82.7197507,4.5,"Coffee & Tea, Nightlife, Beer Bar, Food, Wine Bars, Bars, Tapas/Small Plates, Restaurants, Cafes",4.8,2019,1.0
4683,EVOS Feel Great Food-Carrollwood,10205 Lake Carroll Way,RGTW,Tampa,33664,28.0430197648,-82.5042036063,3.5,"American (Traditional), Fast Food, Restaurants, Organic Stores, Food, Burgers, Salad",3.5,2019,1.0
4690,Sip85,4940 Ridgemoor Blvd,IKXB,Palm Harbor,34685,28.0997669883,-82.691639252,4.5,"Seafood, Wineries, Restaurants, Food, American (New), Arts & Entertainment, Steakhouses",4.2,2019,1.0
469e,717 South,717 S Howard Ave,RGTW,Tampa,33664,27.9360767179,-82.483183,4.0,"American (New), Italian, Restaurants, Asian Fusion, Seafood",3.9,2019,1.0
46a0,Parkside Cafe,8180 49th St N,SJ01,Pinellas Park,33782,27.84619,-82.70033,4.0,"Breakfast & Brunch, Desserts, Seafood, Restaurants, American (Traditional), American (New), Food",4.2,2019,1.0
46ad,Smiley's Deli,3441 Central Ave,9EV3,San Petersburgo,33730,27.7712796,-82.680339,5.0,"Delis, Specialty Food, Restaurants, Food, Ethnic Food, Desserts, Latin American, Sandwiches",4.8,2019,1.0
46b7,Cafe Mozart,6754 4th St N,9EV3,San Petersburgo,33730,27.8343089,-82.6390571,4.5,"Food, Restaurants, Bakeries, Cafes",3.9,2019,1.0
46c0,Miguel's Latin Market,2128 Mariner Blvd,I0WF,Spring Hill,34610,28.4636494,-82.540694,4.0,"Ethnic Food, Specialty Food, Meat Shops, Delis, Grocery, Food, Restaurants, Cuban",4.5,2019,1.0
46c1,New York Kitchen & Lounge,4606 W Boy Scout Blvd,RGTW,Tampa,33664,27.9593884,-82.52283,3.5,"Nightlife, Restaurants, Bars, Sports Bars, Gastropubs",3.6,2019,1.0
46e8,Breeze 19 Kitchen Bar,6818 US Hwy 19,3IHW,New Port Richey,34655,28.2566241,-82.72719070000001,2.5,"American (Traditional), Bars, Seafood, Breakfast & Brunch, Sports Bars, Venues & Event Spaces, Italian, Event Planning & Services, Nightlife, American (New), Restaurants, Steakhouses",2.5,2019,1.0
4712,Tokyo Sushi Bar,5711 E Fowler Ave,RGTW,Tampa,33664,28.0534510673,-82.3921844,4.0,"Sushi Bars, Restaurants, Soup, Asian Fusion, Japanese",4.4,2019,1.0
471c,Bernini Restaurant,1702 E 7th Ave,RGTW,Tampa,33664,27.9605098,-82.4403727,4.0,"Restaurants, Italian",3.8,2019,1.0
472a,Bonefish Grill,13262 N Dale Mabry,RGTW,Tampa,33664,28.005251996632843,-82.55150397201226,3.6,"Seafood, Restaurants, Nightlife, Cocktail Bars, American (New), Bars",3.3,2019,1.0
474a,Longbar Pub & Grill,4701 Normandy Dr,RGTW,Tampa,33664,27.986849,-82.570528,4.0,"Pubs, Food, Bars, Restaurants, American (Traditional), Nightlife, Sports Bars, Dive Bars",3.8,2019,1.0
4750,Spring Garden Family Restaurant,1018 62nd Ave N,9EV3,San Petersburgo,33730,27.828073199999995,-82.648302,4.0,"Restaurants, American (New), Comfort Food, Breakfast & Brunch",3.0,2019,1.0
475f,Embassy Suites by Hilton Tampa Airport Westshore,555 N Westshore Blvd,RGTW,Tampa,33664,27.9490484,-82.5234881,2.5,"Hotels & Travel, Event Planning & Services, Restaurants, Hotels",3.3,2019,1.0
477d,The Hot Tomato,2702 E College Ave,D8OX,Ruskin,33570,27.7135140377,-82.3978910968,4.0,"Bakeries, Sandwiches, Food, Coffee & Tea, Restaurants",3.8,2019,1.0
47b2,¡CUATRO,5300 W Lutz Lake Fern Rd,1GQ7,Lutz,33559,28.154217,-82.529269,3.5,"Bars, Wedding Planning, Nightlife, Lounges, Seafood, American (New), Restaurants, Event Planning & Services",4.0,2019,1.0
47ce,Ginza,"6417 E County Line Rd, Ste 104",RGTW,Tampa,33664,28.169016,-82.356628,3.5,"Restaurants, Sushi Bars, Japanese",3.3,2019,1.0
47dd,Oishi,5800 34th St N,9EV3,San Petersburgo,33730,27.825,-82.6799983,4.0,"Sushi Bars, Japanese, Steakhouses, Restaurants",3.9,2019,1.0
4828,The Boba House,2764 University Sq Dr,RGTW,Tampa,33664,28.0573326,-82.4298366,3.5,"Food, Middle Eastern, Coffee & Tea, Bubble Tea, Taiwanese, Restaurants",3.4,2019,1.0
484c,Aqua Sports Bar & Grille,1365 Kass Cir,I0WF,Spring Hill,34610,28.4537674,-82.5930893,3.5,"Bars, Nightlife, Local Flavor, Cocktail Bars, Pool Halls, Asian Fusion, Jazz & Blues, Arts & Entertainment, Food, Lounges, Beer, Wine & Spirits, Restaurants, Sports Bars",5.0,2019,1.0
4858,Whatever Pops,5127 N Florida Ave,RGTW,Tampa,33664,27.993552,-82.459279,4.5,"Acai Bowls, Restaurants, American (New), Food, Gelato, Street Vendors, Juice Bars & Smoothies, Desserts, Specialty Food, Ice Cream & Frozen Yogurt",4.5,2019,1.0
488b,BARaki,25 Dodecanese Blvd,3IGC,Tarpon Springs,34689,28.1551835,-82.7576679,2.5,"Restaurants, Nightlife, Cocktail Bars, Modern European, Bars, Cafes, Lounges, Mediterranean, Greek, Tapas/Small Plates",1.7,2019,0.5
488d,Jimmy Hula's,454 Mandalay Ave,MCCU,Clearwater,33769,27.990081956928663,-82.63905007747452,3.9,"Mexican, Burgers, Beer, Wine & Spirits, Tacos, Beer Bar, Food, Restaurants, Breakfast & Brunch, Bars, Nightlife",3.6,2019,1.0
48c3,Get Hooked Grill,14333 Crabtrap Ct,Y3QW,Hudson,34669,28.3661364,-82.7052474,3.5,"Steakhouses, Restaurants, Seafood",3.7,2019,1.0
48d2,Quality Foods Market,16307 N Florida Ave,1GQ7,Lutz,33559,28.1024492,-82.4600226,4.5,"Salad, Grocery, Specialty Food, Delis, Food, Beer, Wine & Spirits, Beer Bar, Nightlife, Vegan, Sandwiches, Bars, Pizza, Wine Bars, Desserts, Restaurants",4.6,2019,1.0
48f1,Truly Greek,887 E Bloomingdale Ave,W2W7,Brandon,33511,27.8913359,-82.272563,4.5,"Event Planning & Services, Caterers, Greek, Mediterranean, Middle Eastern, Restaurants",4.6,2019,1.0
4915,Sunday's Delicatessen,1930 E 7th Ave,RGTW,Tampa,33664,27.9604597,-82.4368617,4.0,"Sandwiches, Delis, Restaurants, Breakfast & Brunch",4.4,2019,1.0
491d,Frenchy's Rockaway Grill,7 Rockaway St,EXHF,Clearwater Beach,33767,27.9834667,-82.8278346,4.0,"Sandwiches, American (Traditional), Restaurants, Seafood",4.0,2019,1.0
4957,The Living Room on Main,487 Main St,L2T6,Dunedin,34698,28.0121026,-82.7859653,4.0,"Restaurants, American (New), Cocktail Bars, Breakfast & Brunch, Tapas/Small Plates, Nightlife, Bars, Music Venues, Arts & Entertainment, Sandwiches, Tapas Bars",3.9,2019,1.0
4972,Niki's Gyromania,12578 Spring Hill Dr,I0WF,Spring Hill,34610,28.4657883,-82.5129307,4.0,"Food, Desserts, Restaurants, Food Delivery Services, Greek, Local Flavor, American (Traditional)",4.0,2019,1.0
4988,Grillsmith - Midtown South Tampa,612 N Dale Mabry Hwy,RGTW,Tampa,33664,27.9498483,-82.5060285,4.5,"Restaurants, Steakhouses, Event Planning & Services, Breakfast & Brunch, Venues & Event Spaces, American (Traditional)",4.3,2019,1.0
498f,Latitudes Apollo,131 Harbor Village Ln,20PF,Apollo Beach,33572,27.750914500000004,-82.4124859,4.0,"American (New), Bars, Nightlife, Restaurants",3.9,2019,1.0
49a9,The Barterhouse Ybor,"1811 15th Street Tampa, Ste A",RGTW,Tampa,33664,27.9607259,-82.4427861,4.5,"Nightlife, Bars, American (New), Restaurants",4.7,2019,1.0
49ac,Ivory Chinese Bistro,2192 Main St,L2T6,Dunedin,34698,28.0198391,-82.749349,3.5,"Chinese, Restaurants, Cantonese",3.0,2019,1.0
49af,The Alley At Southshore,10221 Big Bend Rd,TC12,Riverview,33579,27.7900094,-82.3409503,2.5,"Active Life, American (Traditional), Arcades, Restaurants, Arts & Entertainment, Bowling",2.9,2019,1.0
49bb,Tory's Cafe,1266 S Highland Ave,MCCU,Clearwater,33769,27.950690200000004,-82.7755295,5.0,"American (New), Diners, American (Traditional), Restaurants, Cafes, Breakfast & Brunch",4.4,2019,1.0
49c6,SHOR American Seafood Grill,301 South Gulfview Blvd,MCCU,Clearwater,33769,27.9737827,-82.8290238,4.0,"Seafood, American (New), Restaurants, Desserts, Steakhouses, Breakfast & Brunch, Food",3.8,2019,1.0
49d0,Seminole Subs & Gyros,2298 Main St,MCCU,Clearwater,33769,27.942586117977143,-82.76509560225144,4.1,"American (New), Salad, Restaurants, Greek, Sandwiches",4.0,2019,1.0
4a07,Melt'd,5641 Main St,3IHW,New Port Richey,34655,28.250371,-82.720758,4.5,"American (Traditional), Restaurants, Sandwiches",4.0,2019,1.0
4a0c,Famous Kabab Of Tampa,2047 E Fowler Ave,RGTW,Tampa,33664,28.0532638009,-82.4370956499,3.5,"Bangladeshi, Indian, Pakistani, Restaurants",3.5,2019,1.0
4a1e,Eatin' Fresh,721 Lakeview Rd,MCCU,Clearwater,33769,27.94861,-82.79611,4.5,"Seafood, Specialty Food, Seafood Markets, Restaurants, Cuban, Farmers Market, Beer Gardens, Sandwiches, Local Flavor, Food, Nightlife",5.0,2019,1.0
4a5a,Shells Seafood Restaurant - Brandon,115 E Brandon Blvd,W2W7,Brandon,33511,27.9368983,-82.2847614,4.5,"Restaurants, Seafood",4.4,2019,1.0
4a87,Los Poncenos PR Bar & Grill,4103 FL- 574,7QXG,Plant City,33567,28.0087335,-82.164437,2.5,"Nightlife, Restaurants, Puerto Rican, Caribbean, Bars",2.7,2019,0.5
4a8e,Counter Culture,"2909 W Bay To Bay Blvd, Ste 100",RGTW,Tampa,33664,27.9198352,-82.4917969,3.5,"American (New), Restaurants, Diners, Nightlife, Bars",4.5,2019,1.0
4a96,Jasmine Thai and Sushi Restaurant,4516 S Dale Mabry Hwy,RGTW,Tampa,33664,27.9014971,-82.5059198,3.5,"Restaurants, Thai, Sushi Bars",3.9,2019,1.0
4aa6,Goody Goody,"4100 George J Bean Pkwy, Terminal C, Tampa International Airport",RGTW,Tampa,33664,27.9822260092,-82.5318517668,2.5,"Diners, Restaurants, Burgers, Breakfast & Brunch",2.5,2019,1.0
4ace,Si-Am Thai,713 N Franklin St,RGTW,Tampa,33664,27.9504891,-82.4590146,4.0,"Restaurants, Thai, Asian Fusion, Salad, Beer Bar, Soup, Nightlife, Comfort Food, Bars",3.7,2019,1.0
4af8,Circles Waterfront at Lands End Marina,1212 Apollo Beach Blvd,20PF,Apollo Beach,33572,27.7803027,-82.4228172,4.0,"Seafood, Restaurants, Steakhouses, Bars, Nightlife",4.0,2019,1.0
4b0a,Persia House of Kababs,"1441 E Fletcher Ave, Ste 123",RGTW,Tampa,33664,28.0688438416,-82.4438476562,3.5,"Persian/Iranian, Restaurants, Halal",4.4,2019,1.0
4b26,China Park,11651 Boyette Rd,TC12,Riverview,33579,27.8522826,-82.3045825,3.0,"Restaurants, Chinese",3.0,2019,1.0
4b33,Serbian Mediteran Restaurant,6500 4th St N,9EV3,San Petersburgo,33730,27.8320015,-82.639144,5.0,"Restaurants, Fast Food, Mediterranean",5.0,2019,1.0
4b3b,Hey Giant,6607 Florida Ave,RGTW,Tampa,33664,28.0079298,-82.4593,4.5,"Bakeries, Tutoring Centers, Food, Pop-Up Restaurants, Restaurants, Education",1.0,2019,1.0
4b50,Meal & Grill,"4040 W Waters Ave, Ste 108",RGTW,Tampa,33664,28.0250407,-82.5120301,4.0,"Sandwiches, Latin American, Restaurants, Steakhouses, Barbeque, Buffets, Brazilian",3.6,2019,1.0
4b5c,Europa Cafe,12125 Indian Rocks Rd,LIFE,Largo,33778,27.94017037819048,-82.46500758990476,3.5,"Breakfast & Brunch, Cafes, American (Traditional), Restaurants, American (New)",3.1,2019,1.0
4b69,Clearwater Oyster Company,655 S Gulfview Blvd,MCCU,Clearwater,33769,27.9664356,-82.8257535,4.5,"Restaurants, Breakfast & Brunch, Seafood",4.3,2019,1.0
4b72,The Kitchen,156 4th Ave N,B8F4,Safety Harbor,34695,27.990467096,-82.6802378,4.0,"Seafood, Nightlife, Restaurants, Bars, Sushi Bars, Cocktail Bars, Tapas/Small Plates, American (New)",3.6,2019,1.0
4ba9,Kona Grill - Tampa,"4134 W Boy Scout Blvd, Ste B-1",RGTW,Tampa,33664,27.964528,-82.5136519,3.5,"Sushi Bars, American (New), Asian Fusion, Restaurants",3.4,2019,1.0
4bb1,Pane Rustica,3225 S Macdill Ave,RGTW,Tampa,33664,27.9157286,-82.494673,4.5,"Restaurants, Cafes, American (New), Bakeries, Food, Italian",4.3,2019,1.0
4bb6,Poké Fun,"2727 Ulmerton Rd, Ste 110",MCCU,Clearwater,33769,27.895033692700004,-82.6706871381,4.5,"Poke, Food, Japanese, Restaurants, Hawaiian",4.2,2019,1.0
4bce,Backwaters on Sand Key,"1261 Gulf Blvd, Ste 130",EXHF,Clearwater Beach,33767,27.951998,-82.829696,3.5,"Restaurants, Seafood",4.0,2019,1.0
4bde,Mazzaro's Italian Market,2909 22nd Ave N,9EV3,San Petersburgo,33730,27.7922562,-82.673539,4.5,"Specialty Food, Delis, Coffee Roasteries, Butcher, Meat Shops, Food, Restaurants, Grocery, Italian",4.7,2019,1.0
4bf3,Hillsborough State Park Poolside Cafe,15402 N Hwy 301,UGDG,Thonotosassa,33592,28.147995,-82.234892,4.5,"Restaurants, Cafes, Beer, Wine & Spirits, Active Life, Rafting/Kayaking, Food, Bike Rentals",5.0,2019,1.0
4c1d,Frank And Papi Latin Restaurant,7315 E Broadway Ave,RGTW,Tampa,33664,27.9664073,-82.3733485,3.5,"Dominican, Cuban, Spanish, Caribbean, Restaurants",5.0,2019,1.0
4c35,Mise En Place,"442 W Kennedy Blvd, Ste 110",RGTW,Tampa,33664,27.9446797287,-82.465137038,4.0,"Event Planning & Services, Restaurants, Venues & Event Spaces, Nightlife, Wine Bars, Caterers, American (New), Bars",3.9,2019,1.0
4c4c,Newk's Eatery,"2613 Gulf To Bay Blvd, Ste 1650",MCCU,Clearwater,33769,27.9600016,-82.7287208,4.0,"Sandwiches, Salad, American (New), American (Traditional), Pizza, Restaurants",3.7,2019,1.0
4c76,Taqueria La Mexicana,14516 N 22nd St,RGTW,Tampa,33664,28.0800701062,-82.43505,4.0,"Restaurants, Food Trucks, Mexican, Tacos, Food",4.7,2019,1.0
4c86,El Rincon Mexicano,4109 State Rd 574,7QXG,Plant City,33567,28.0089108,-82.1647557,3.5,"Restaurants, Mexican",3.0,2019,1.0
4c88,A-Green Oriental Market,1321 E Fletcher Ave,RGTW,Tampa,33664,28.0686501,-82.445243,4.0,"Ethnic Food, Grocery, Restaurants, Imported Food, Food, Specialty Food, Vegan",5.0,2019,1.0
4cb6,NY Dog House,3480 Us-19,I0WF,Spring Hill,34610,28.482576,-82.606862,4.5,"Food Trucks, Fast Food, Food, Hot Dogs, Restaurants, Chicken Wings",4.4,2019,1.0
4cbd,Tony's Pizzeria & Ristorante,428 Cleveland St,MCCU,Clearwater,33769,27.9657274198,-82.8002682222,3.0,"Bars, Pizza, Italian, Nightlife, Food, Restaurants",3.5,2019,1.0
4cd3,"Wayne Lee, MD","1020 E Brandon Blvd, Ste 101",W2W7,Brandon,33511,27.9387346,-82.2672957,5.0,"Plastic Surgeons, Doctors, Cosmetic Surgeons, Beauty & Spas, Skin Care, Restaurants, Pizza, Health & Medical, Medical Spas",5.0,2019,1.0
4cee,Yah Mon,"301 W Platt St, Unit C",RGTW,Tampa,33664,27.9422145,-82.4629632,4.5,"Restaurants, Caribbean",4.6,2019,1.0
4cf7,Nabruzzi Trattoria,6062 Van Dyke Rd,1GQ7,Lutz,33559,28.1276495,-82.5414392,4.5,"Restaurants, Event Planning & Services, Bars, Caterers, Venues & Event Spaces, Italian, Pizza, Wine Bars, Nightlife",4.4,2019,1.0
4d04,Memphis Style BBQ,,LIFE,Largo,33778,27.8847538,-82.8263615,4.5,"Event Planning & Services, Restaurants, Caterers, Barbeque, Food Stands",3.2,2019,1.0
4d34,Kobe Japanese Steakhouse - Brandon,2210 W Brandon Blvd,W2W7,Brandon,33511,27.93943,-82.3217459,4.0,"Steakhouses, Sushi Bars, Restaurants, Japanese",4.4,2019,1.0
4d7c,Johnny's Italian Restaurant,"2907 State Road 590, Ste 1",MCCU,Clearwater,33769,27.9822,-82.7167155,3.5,"Italian, Desserts, Food, Salad, Restaurants",3.8,2019,1.0
4dad,Plateroti Italian Gourmet Inc,1621 Gulf To Bay Blvd,MCCU,Clearwater,33769,27.9603395,-82.7698708,4.5,"Food, Restaurants, Specialty Food, Delis",4.5,2019,1.0
4daf,Xtreme Tacos Food Truck,6809 N Nebraska Ave,RGTW,Tampa,33664,28.0100358,-82.4506185,4.5,"Food, Restaurants, American (Traditional), Mexican, Tex-Mex, Food Trucks, Tacos",4.5,2019,1.0
4db8,Asian Yummy House,10697 Big Bend Rd,TC12,Riverview,33579,27.790426000000004,-82.331767,3.5,"Japanese, Chinese, Restaurants, Thai",3.6,2019,1.0
4dc0,Danny's All American Diner and Dairy Bar,4406 N Falkenburg Rd,RGTW,Tampa,33664,27.9855777,-82.3353761,4.0,"American (Traditional), Burgers, Sandwiches, Restaurants, Diners",4.3,2019,1.0
4de3,Ryan's Island Cafe,432 Poinsettia Ave,MCCU,Clearwater,33769,27.9796955,-82.8266351,4.5,"Restaurants, Diners, Burgers, Sandwiches, Breakfast & Brunch",4.7,2019,1.0
4e14,Kaleisia Tea Lounge,"1441 E Fletcher Ave, Ste 101",RGTW,Tampa,33664,28.069055,-82.443811,4.5,"Restaurants, Vegan, Juice Bars & Smoothies, Coffee & Tea, Asian Fusion, Tea Rooms, Food, Vietnamese, Cafes",4.6,2019,1.0
4e1a,China Taste,876 E Tarpon Ave,3IGC,Tarpon Springs,34689,28.01128226002258,-82.62431449572257,3.5,"Chinese, Restaurants",3.4,2019,1.0
4e25,Cowboy Corral Bar & Grill,6250 Ulmerton Rd,MCCU,Clearwater,33769,27.8933756,-82.7210855484,4.0,"Restaurants, Bar Crawl, American (Traditional), Bars, Sports Bars, Nightlife",4.2,2019,1.0
4e31,Costanera Peruvian Cuisine,3869 Northdale Blv,RGTW,Tampa,33664,28.094242226599995,-82.5053111644,3.5,"Peruvian, Seafood, Restaurants, Latin American",3.8,2019,1.0
4e36,The BBQ Spot,6975 66th St N,SJ01,Pinellas Park,33782,27.8351429,-82.7280337,4.0,"Barbeque, Soul Food, Restaurants",4.3,2019,1.0
