id_nombre,nombre,direccion,id_ciudad,ciudad,codigo_postal,latitud,longitud,puntuacion_yelp,categories,puntuacion_usuarios,anio,analisis_sentimientos
4e91,Silver Ring Cafe,1430 E 7th Ave,RGTW,Tampa,33664,27.9605431,-82.4431725,4.0,"Local Flavor, Restaurants, American (New)",4.0,2008,1.0
4ef3,Johnny Rockets,7989 Citrus Park Town Ctr Mall,RGTW,Tampa,33664,28.070087,-82.576617,3.0,"American (Traditional), Restaurants, American (New), Fast Food, Burgers, Sandwiches, Diners",1.0,2008,1.0
4f58,Vallarta Mexican Restaurant,9255 N 56th St,RGTW,Tampa,33664,28.0342337,-82.3927929,2.5,"Mexican, Restaurants",4.0,2008,1.0
4f94,First Choice Southern Bar-B Que,10113 Adamo Dr,RGTW,Tampa,33664,27.942242297,-82.3400769223,4.0,"Restaurants, American (Traditional), Barbeque",3.7,2008,1.0
5014,LongHorn Steakhouse,2055 N Dale Mabry Hwy,RGTW,Tampa,33664,27.9609092,-82.5048404,2.5,"Steakhouses, American (Traditional), Restaurants",5.0,2008,1.0
5042,Country Pizza Inn,25856 US Hwy 19 N,MCCU,Clearwater,33769,28.0073796,-82.7308577,3.5,"Restaurants, Pizza",1.0,2008,1.0
5052,Jasmine Thai Restaurant,13248 N Dale Mabry Hwy,RGTW,Tampa,33664,28.068673,-82.5068579,3.5,"Chinese, Thai, Restaurants",3.5,2008,1.0
5059,Crown & Bull,319 Main St,L2T6,Dunedin,34698,28.0116959,-82.7894068,3.5,"Bars, Nightlife, American (Traditional), Restaurants, Breakfast & Brunch",4.0,2008,1.0
5191,Gratzzi Italian Grille,211 2nd St S,9EV3,San Petersburgo,33730,27.7691918,-82.635785,4.0,"Restaurants, Italian",4.0,2008,1.0
51eb,Logan's Roadhouse,9218 Anderson Rd,RGTW,Tampa,33664,28.031703,-82.540911,3.0,"Steakhouses, American (Traditional), Bars, Nightlife, Restaurants, Barbeque",4.0,2008,1.0
5316,Jason's Deli,"2702 E Fowler Ave, Ste B",RGTW,Tampa,33664,28.055118,-82.4292682,4.0,"Restaurants, Event Planning & Services, Delis, Sandwiches, Salad, Caterers",4.0,2008,1.0
5346,KFC,7605 W Hillsborough Ave,RGTW,Tampa,33664,27.9969230179,-82.5651973877,2.0,"Chicken Wings, Restaurants, Chicken Shop, Fast Food",1.0,2008,1.0
53ce,Widow Brown's Restaurant,2076 Seminole Blvd,LIFE,Largo,33778,27.8975869,-82.7874765,4.0,"Restaurants, American (Traditional)",1.0,2008,1.0
53e7,Tum Nuk Thai,11002 Seminole Blvd,LIFE,Largo,33778,27.775941275,-82.7067004,3.6,"Thai, Restaurants",4.2,2008,1.0
54fc,La Tropicana Cafe,1822 E 7th Ave,RGTW,Tampa,33664,27.960413,-82.438222,2.5,"Restaurants, Cuban, Cafes, Breakfast & Brunch",4.0,2008,1.0
554d,Down To the Bone Bbq & Catering,110 S Kings Ave,W2W7,Brandon,33511,27.936342,-82.2941171,3.5,"Restaurants, Caterers, Event Planning & Services, Barbeque",3.0,2008,1.0
55ea,P.F. Chang's,219 Westshore Plz,RGTW,Tampa,33664,27.9468722,-82.5261785,3.0,"Chinese, Gluten-Free, Restaurants, Asian Fusion",3.0,2008,1.0
55ef,Redlands Grill by J. Alexander's,913 Dale Mabry Hwy,RGTW,Tampa,33664,27.9519547257,-82.5040393541,4.0,"Restaurants, Steakhouses, Seafood, American (New)",5.0,2008,1.0
560f,Famous Greek Salads of Florida,10041 N Dale Mabry Hwy,RGTW,Tampa,33664,28.0406649,-82.504751,3.5,"Restaurants, Greek",5.0,2008,1.0
5695,Cappy's Pizzeria- Seminole Heights,4910 N Florida Ave,RGTW,Tampa,33664,27.9912707,-82.4596841,3.5,"Restaurants, Food, Pizza",5.0,2008,1.0
5838,Wat Mongkolratanaram of Florida,5306 Palm River Rd,RGTW,Tampa,33664,27.944096,-82.395179,4.5,"Religious Organizations, Restaurants, Local Flavor, Thai, Buddhist Temples, Churches",5.0,2008,1.0
5842,Sami's Bakery,4914 E Busch Blvd,RGTW,Tampa,33664,28.0333063,-82.4042829,4.0,"Food, Bakeries, Restaurants",5.0,2008,1.0
5869,Wasabi Japanese Steakhouse and Sushi,19601 Bruce B Downs Blvd,RGTW,Tampa,33664,28.1518346,-82.3528676,2.5,"Restaurants, Japanese",3.0,2008,1.0
58ad,Fuji Sushi,1155 S Dale Mabry Hwy,RGTW,Tampa,33664,27.9325314,-82.5068063,3.5,"Sushi Bars, Restaurants",2.5,2008,1.0
58b6,Thai Bistro,5414 Main St,3IHW,New Port Richey,34655,28.159708100000003,-82.5774998,4.0,"Restaurants, Thai",4.0,2008,1.0
58cd,Joto's Pizza - Seminole,13050 Park Blvd,8ZKX,Seminole,33777,27.8432698,-82.8192403,3.5,"Pizza, Restaurants, Food Delivery Services, Food, Italian",3.0,2008,1.0
592b,Tun-Du-Ree,1506 W Kennedy Blvd,RGTW,Tampa,33664,27.9442747,-82.4751004,3.0,"Pakistani, Restaurants, Indian, Food",5.0,2008,1.0
595b,Plaka Restaurant,769 Dodecanese Blvd,3IGC,Tarpon Springs,34689,28.1554374,-82.7615673,3.5,"Sandwiches, Restaurants, Greek",5.0,2008,1.0
598e,Harr's Surf & Turf Market Inc,3235 Tampa Rd,IKXB,Palm Harbor,34685,28.0675269,-82.7250507,2.0,"Specialty Food, Caterers, Meat Shops, Delis, Beer, Wine & Spirits, Restaurants, Food, Event Planning & Services, Seafood Markets",4.0,2008,1.0
59af,Demmi's Market On 7th,1816 E 7th Ave,RGTW,Tampa,33664,27.9604422,-82.4386924,4.5,"Nightlife, Music Venues, Pizza, Restaurants, Arts & Entertainment, Cocktail Bars, Bars",5.0,2008,1.0
59cf,Tank's Tap Room,13150 N Dale Mabry Hwy,RGTW,Tampa,33664,28.0666795,-82.5054012,2.5,"Bars, Food, Burgers, Nightlife, Restaurants, Local Flavor, Beer, Wine & Spirits, Sports Bars",4.0,2008,1.0
5a1b,Flamestone American Grill,4009 Tampa Rd,96OP,Oldsmar,34677,28.0377657,-82.6586114,4.0,"American (Traditional), American (New), Cocktail Bars, Restaurants, Seafood, Breakfast & Brunch, Steakhouses, Gluten-Free, Nightlife, Bars",3.5,2008,1.0
5a2b,PoFolks,2001 34th St N,9EV3,San Petersburgo,33730,27.789875,-82.678791,4.0,"American (Traditional), Restaurants, American (New), Southern",4.0,2008,1.0
5adc,Smokey Bones,136 Brandon Town Center Dr,W2W7,Brandon,33511,27.949229,-82.5259566108,3.2,"Restaurants, American (Traditional), Barbeque, Carpet Cleaning, Burgers, Chicken Wings, Local Services",3.5,2008,1.0
5b80,Savannah's Cafe,1113 Central Ave,9EV3,San Petersburgo,33730,27.7712521,-82.6505182,2.5,"Restaurants, Southern",2.3,2008,1.0
5c1e,Kobe Japanese Steakhouse - Clearwater,28775 US-19 N,MCCU,Clearwater,33769,28.033686,-82.737182,4.0,"Food, Sushi Bars, Asian Fusion, Steakhouses, Japanese, Restaurants",4.0,2008,1.0
5c28,World Of Beer,9524 W Linebaugh Ave,RGTW,Tampa,33664,28.043243005,-82.5922461274,4.0,"Restaurants, Pubs, Music Venues, American (Traditional), Nightlife, Bars, Arts & Entertainment",4.0,2008,1.0
5c52,Thai Wok,11270 4th St N,9EV3,San Petersburgo,33730,27.874373,-82.640223,4.0,"Thai, Restaurants",3.5,2008,1.0
5ced,Tiparos Thai Restaurant,4755 Gulf Blvd,9EV3,San Petersburgo,33730,27.722163,-82.7403194,4.5,"Thai, Restaurants",4.0,2008,1.0
5d7e,Starlite Majesty,25 Causeway Blvd,EXHF,Clearwater Beach,33767,27.976757000000003,-82.826572,3.0,"Event Planning & Services, Boating, Boat Charters, Restaurants, Breakfast & Brunch, Active Life",3.7,2008,1.0
5d9b,Ceviche Tapas Bar & Restaurant,2500 W Azeele St,RGTW,Tampa,33664,27.9408723,-82.4852045,4.0,"Tapas Bars, Spanish, Basque, Restaurants",3.4,2008,1.0
5ebd,Taco Bell,3600 4th Street North,9EV3,San Petersburgo,33730,27.79682720205,-82.6838578191,2.0,"Restaurants, Breakfast & Brunch, Fast Food, Tex-Mex, Tacos, Mexican",4.0,2008,1.0
5f05,Umbertos of Long Island,150 Patricia Ave,L2T6,Dunedin,34698,28.0018357,-82.7758572,4.0,"Pizza, Sandwiches, Restaurants, Italian",4.0,2008,1.0
5f4a,Sam Snead's Grill and Tavern,5503 W Spruce St,RGTW,Tampa,33664,27.9640173,-82.5344751,3.0,"American (Traditional), Restaurants",2.0,2008,1.0
5fb1,California Pizza Kitchen at International Plaza,"2223 N West Shore Blvd, Space 189",RGTW,Tampa,33664,27.963903,-82.521648,4.0,"Restaurants, American (New), Pizza, Salad, American (Traditional)",3.6,2008,1.0
5feb,Eddie's Bar & Grill,1283 N Bayshore Blvd,L2T6,Dunedin,34698,28.0220007169,-82.7892576364,3.5,"Burgers, Bars, Nightlife, American (New), Restaurants, American (Traditional), Sports Bars",4.5,2008,1.0
6074,Joe's Crab Shack,2730 Gulf To Bay Blvd,MCCU,Clearwater,33769,27.9611561714,-82.7246783674,3.0,"Nightlife, Restaurants, American (Traditional), Bars, Seafood",3.0,2008,1.0
60dd,Lincoln Spanish Restaurant,3247 W Columbus Dr,RGTW,Tampa,33664,27.9670122,-82.4970648,3.5,"Latin American, Restaurants, Spanish, Cuban",3.0,2008,1.0
61ba,Doe Doe's Diner,9395 Bay Pines Blvd,9EV3,San Petersburgo,33730,27.8142345,-82.7691387,4.0,"Coffee & Tea, Breakfast & Brunch, Restaurants, Food",4.0,2008,1.0
6252,Parkshore Grill,"300 Beach Dr NE, Ste 104",9EV3,San Petersburgo,33730,27.7751514279,-82.6324065513,4.0,"Caterers, American (New), Food, Seafood, American (Traditional), Restaurants, Event Planning & Services, Steakhouses",3.2,2008,1.0
6408,Original Westshore Pizza South Tampa,4802 W Bay Ct Ave,RGTW,Tampa,33664,27.9071222,-82.5270814,3.0,"Restaurants, Pizza, Sandwiches, American (Traditional), Salad",4.0,2008,1.0
6480,Sushi Zen,11024 4th St N,9EV3,San Petersburgo,33730,27.8716422,-82.6389396,2.5,"Sushi Bars, Korean, Restaurants",3.0,2008,1.0
6533,Papa John's Pizza,1543 S Parsons Ave,JIN0,Seffner,33584,27.88839205,-82.46269845,3.0,"Restaurants, Pizza",4.0,2008,1.0
6541,Sam's Beach Bar,6325 Clark St,Y3QW,Hudson,34669,28.3619386,-82.7103407,3.5,"Seafood, American (Traditional), Music Venues, Caribbean, Arts & Entertainment, Nightlife, Restaurants",2.8,2008,1.0
65c3,La Teresita Cafe,3246 W Columbus Dr,RGTW,Tampa,33664,27.9664282,-82.4963345,4.0,"Bakeries, Caterers, Grocery, Cuban, Spanish, Food, Seafood, Restaurants, Event Planning & Services",3.1,2008,1.0
6684,J D's Restaurant & Lounge,125 Gulf Blvd,SOWC,Indian Rocks Beach,33785,27.8791056191,-82.8501277135,3.0,"Bars, Seafood, Nightlife, Lounges, Restaurants",2.0,2008,1.0
66e0,The Melting Pot,2221 4th St N,9EV3,San Petersburgo,33730,27.883909266666667,-82.59448086666667,3.7,"American (New), Fondue, Gluten-Free, Restaurants, Salad",4.3,2008,1.0
66fd,Clear Sky Cafe,"490 Mandalay Ave, Ste 1",MCCU,Clearwater,33769,27.9819599851,-82.8272973318,4.5,"Restaurants, American (Traditional), Tapas/Small Plates, Seafood, Breakfast & Brunch, American (New)",5.0,2008,1.0
6960,Wild Wing Cafe,9210 Anderson Rd,RGTW,Tampa,33664,28.031429,-82.5420539,3.0,"Barbeque, Restaurants, American (Traditional)",1.0,2008,0.5
69dc,Monstah Lobstah,1901 W Platt,RGTW,Tampa,33664,27.942091,-82.479153,4.0,"Seafood, Restaurants",5.0,2008,1.0
6a00,Kabuki Japanese Restaurant,"2020 W Brandon Blvd, Ste 160",W2W7,Brandon,33511,27.938567,-82.317683,3.5,"Japanese, Restaurants",4.0,2008,1.0
6a70,Hugo's Spanish Restaurant,931 S Howard Ave,RGTW,Tampa,33664,27.9341267,-82.4832823,4.0,"Spanish, Cuban, Restaurants",4.0,2008,1.0
6aa3,Bahama Breeze,3045 N Rocky Pt Dr E,RGTW,Tampa,33664,27.9697761464,-82.5627375239,3.5,"Restaurants, Latin American, Laotian, Caribbean, Nightlife, American (Traditional), Seafood, Bars",3.0,2008,1.0
6ad2,Sukhothai Restaurant,8201 N Dale Mabry Hwy,RGTW,Tampa,33664,28.0231326,-82.5042586,4.0,"Restaurants, Thai",4.2,2008,1.0
6ae7,Britt's Laguna Grill,309 S Gulfview Blvd,EXHF,Clearwater Beach,33767,27.9739822,-82.8292925,2.5,"American (New), Restaurants",3.5,2008,1.0
6aeb,Cacciatore Bros,5610 Hanley Rd,RGTW,Tampa,33664,28.0000757,-82.5632646,4.0,"Delis, Grocery, Food, Restaurants, Meat Shops, Butcher, Specialty Food",4.0,2008,1.0
6b91,Bob Heilman's Beachcomber Restaurant,447 Mandalay Ave,EXHF,Clearwater Beach,33767,27.9801452,-82.8268245,3.5,"Seafood, Steakhouses, Restaurants, American (Traditional)",5.0,2008,1.0
6bab,Gator's Dockside - Tampa,5840 E Fowler Ave,RGTW,Tampa,33664,28.0548911,-82.3905826,3.5,"American (Traditional), Nightlife, Chicken Wings, Restaurants, Bars, Sports Bars, Fish & Chips",4.0,2008,1.0
6c1b,Athenian Garden,6940 22nd Ave N,9EV3,San Petersburgo,33730,27.7907780561,-82.7351868466,4.0,"Greek, Restaurants",4.0,2008,1.0
6d42,CJ's Tavern,1318 W Linebaugh Ave,RGTW,Tampa,33664,28.0398731,-82.4723449,3.0,"Bars, Restaurants, American (Traditional), Nightlife, American (New)",4.0,2008,1.0
6ef3,Firehouse Subs,13236 N Dale Mabry,RGTW,Tampa,33664,28.0683175485,-82.5065566113,3.5,"Fast Food, Sandwiches, Delis, Restaurants",4.0,2008,1.0
6f35,Schnitzelhaus Restaurant,4333 W Waters Ave,RGTW,Tampa,33664,28.0258449,-82.5164239,3.0,"Restaurants, German",5.0,2008,1.0
6f84,China99,1467 S Belcher Rd,MCCU,Clearwater,33769,27.9433218978,-82.7455049309,3.0,"Restaurants, Chinese, Seafood, Soup",5.0,2008,1.0
700d,McDonald's,1520 W Kennedy Blvd,RGTW,Tampa,33664,27.9442429463,-82.4754068955,2.0,"Burgers, Restaurants, Fast Food, Coffee & Tea, Food",2.0,2008,0.5
7079,Pollo Tropical,3134 Tampa Rd,96OP,Oldsmar,34677,28.037822725,-82.64817675,2.6,"Latin American, Chicken Shop, Fast Food, Restaurants, Caribbean, Cuban",3.5,2008,1.0
713a,Cali - Saint Petersburg,190 37th Ave N,9EV3,San Petersburgo,33730,27.8071396,-82.6352821,4.5,"Restaurants, Wraps, Juice Bars & Smoothies, Food, American (New), Mediterranean, Breakfast & Brunch, Gluten-Free, Pizza",5.0,2008,1.0
71b5,Ichiban Japanese Restaurant & Sushi Bar,2050 16th St N,9EV3,San Petersburgo,33730,27.790962,-82.6553597,4.0,"Sushi Bars, Japanese, Restaurants, Thai",1.0,2008,0.5
71de,Denny's,2004 N Dale Mabry Hwy,RGTW,Tampa,33664,27.9598673716,-82.5062573701,3.5,"Breakfast & Brunch, Diners, Restaurants, American (Traditional), Fast Food",3.0,2008,0.5
7209,Green Iguana Bar & Grill,4029 S Westshore Blvd,RGTW,Tampa,33664,27.95343285,-82.48588478333333,3.2,"Restaurants, Bars, Sports Bars, Nightlife, American (Traditional), Food, Beer, Wine & Spirits",3.8,2008,1.0
7223,The Three Coins Diner,7410 N Nebraska Ave,RGTW,Tampa,33664,28.0159759,-82.4514757,4.0,"American (Traditional), Restaurants",4.0,2008,1.0
7292,La Bamba restaurante,4815 W Laurel St,RGTW,Tampa,33664,27.9562645,-82.5253904,4.0,"Cuban, Spanish, Restaurants",3.0,2008,1.0
744f,Sinigual Contemporary Mexican  Cuisine,"Brandon Town Center Mall, 805 Brandon Town Ctr",W2W7,Brandon,33511,27.9286726,-82.3244013,3.5,"Restaurants, Mexican",3.0,2008,1.0
7483,Pinky's,3203 W Bay To Bay Blvd,RGTW,Tampa,33664,27.919892,-82.4954903,4.0,"Breakfast & Brunch, Restaurants, Food, Sandwiches, Diners, Coffee & Tea",4.0,2008,1.0
7537,Moxies Cafe and Caterer,514 N Tampa St,RGTW,Tampa,33664,27.9485,-82.4595609,4.0,"Breakfast & Brunch, Cafes, Delis, American (Traditional), Sandwiches, Event Planning & Services, Coffee & Tea, Food, Caterers, Restaurants",5.0,2008,1.0
76a3,Paul's Shrimp House,80 W Live Oak St,3IGC,Tarpon Springs,34689,28.154536,-82.757829,3.5,"Seafood, Restaurants",5.0,2008,1.0
7702,Applebee's Grill + Bar,4016 Tampa Rd,96OP,Oldsmar,34677,28.035302,-82.6565228,2.5,"American (Traditional), Restaurants, Nightlife, Bars, Sports Bars, Steakhouses, Burgers",4.0,2008,1.0
780f,The Venue,2675 Ulmerton Rd,MCCU,Clearwater,33769,27.8945283,-82.6697782,2.5,"Tapas Bars, Nightlife, Dance Clubs, Bars, Restaurants",3.0,2008,1.0
79be,Yummy House,2202 W Waters Ave,RGTW,Tampa,33664,28.025082,-82.481491,4.0,"Chinese, Restaurants",4.0,2008,1.0
79f9,Leafy Greens Cafe,1626 Central Ave,9EV3,San Petersburgo,33730,27.7708615624,-82.6555204405,4.0,"Soup, Gluten-Free, Breakfast & Brunch, Vegetarian, Vegan, Restaurants",1.0,2008,1.0
7a40,Dunedin Brewery,937 Douglas Ave,L2T6,Dunedin,34698,28.0139804694,-82.7877538767,4.0,"Arts & Entertainment, Nightlife, Music Venues, Breweries, American (Traditional), Food, Restaurants",4.5,2008,1.0
7a77,Kooky Coconut,760 Gulf Blvd,SOWC,Indian Rocks Beach,33785,27.8895071478,-82.8500081196,4.5,"Ice Cream & Frozen Yogurt, Sandwiches, Food, Cafes, Restaurants",5.0,2008,1.0
7ab7,Nickel City Sushi & Sports Bar,7658 Park Blvd N,SJ01,Pinellas Park,33782,27.8387636,-82.7440222,3.5,"Thai, Sports Bars, Asian Fusion, Vietnamese, American (Traditional), Restaurants, Bars, Sushi Bars, Nightlife",2.0,2008,1.0
7bf1,Lucky Dill Deli,33180 US 19 N,IKXB,Palm Harbor,34685,28.0739331799,-82.7397437681,3.5,"Coffee & Tea, Restaurants, Desserts, Food, American (New), Sandwiches, Breakfast & Brunch, Delis",1.0,2008,1.0
7c03,Deeya Indian Cuisine,5166 E Bay Dr,MCCU,Clearwater,33769,27.9164043,-82.7332593,3.5,"Restaurants, Indian",3.5,2008,1.0
7cd4,Bern's Steak House,1208 S Howard Ave,RGTW,Tampa,33664,27.9318624,-82.4827004,4.5,"Arts & Entertainment, Steakhouses, Restaurants",4.2,2008,1.0
7d42,Crispers,15726 North Dale Mabry,RGTW,Tampa,33664,27.980325773266667,-82.38698344699999,3.2,"American (Traditional), Delis, Restaurants, Soup, Sandwiches, Salad",3.3,2008,1.0
7d89,The Colonnade Restaurant,3401 Bayshore Bvld,RGTW,Tampa,33664,27.9123133,-82.4916655,3.0,"Seafood, American (New), Restaurants",4.0,2008,1.0
7e69,China Wok,5055 34th St S,9EV3,San Petersburgo,33730,27.721666,-82.6807564,3.5,"Restaurants, Chinese",4.0,2008,1.0
7eb7,The Cheesecake Factory,"2223 N West Shore Blvd, Ste B201, International Plaza",RGTW,Tampa,33664,27.9646824142,-82.5206448411,3.5,"Salad, Desserts, Food, Restaurants, American (Traditional), American (New), Seafood",4.5,2008,1.0
7f28,Bua Luang Thai,608 Mandalay Ave,MCCU,Clearwater,33769,27.9860504,-82.8267195,3.5,"Thai, Restaurants",3.5,2008,1.0
7f75,Charley's Steak House,4444 West Cypress Street,RGTW,Tampa,33664,27.951538,-82.519544,4.0,"Steakhouses, Restaurants, Seafood",5.0,2008,1.0
7fcb,Shep's Food Mart,2001 4th St N,9EV3,San Petersburgo,33730,27.7909036,-82.6382366,4.5,"Grocery, Delis, Food, Beer, Wine & Spirits, Restaurants",5.0,2008,1.0
8273,Pacific Wave,211 2nd St S,9EV3,San Petersburgo,33730,27.7693413,-82.6355183,4.0,Restaurants,4.0,2008,1.0
8282,Sandbar Grill,2602 Bayshore Blvd,L2T6,Dunedin,34698,28.0499496074,-82.7809771101,3.5,"Restaurants, Seafood",4.0,2008,1.0
8299,Ai Mei Thai Restaurant,4200 34th St S,9EV3,San Petersburgo,33730,27.729857,-82.678614,2.0,"Thai, Restaurants",3.0,2008,1.0
82d2,Rouen Thai,3324 W Gandy Blvd,RGTW,Tampa,33664,27.8933512,-82.4995947,4.0,"Thai, Restaurants, Noodles, Soup",3.0,2008,1.0
8355,The Bungalow Tampa,2202 W Kennedy Blvd,RGTW,Tampa,33664,27.9445198,-82.4821729,3.0,"Seafood, American (New), Nightlife, Breakfast & Brunch, Sports Bars, Restaurants, Bars, Caribbean, Cuban",3.5,2008,1.0
83b9,Tara's Roti Shop,10006 N 30th St,RGTW,Tampa,33664,28.0402911,-82.4266172,3.5,"Caribbean, Restaurants, Imported Food, Ethnic Food, Food, Specialty Food",4.0,2008,1.0
840b,Clearwater Wine Bar & Bistro,482 Poinsettia Ave,EXHF,Clearwater Beach,33767,27.9815251,-82.8262496,4.5,"Bars, Wine Bars, American (New), Nightlife, Mexican, Mediterranean, Restaurants",4.0,2008,1.0
8459,Thai Spice Restaurant,"2475 McMullen Booth Rd, Ste B",MCCU,Clearwater,33769,28.011366,-82.71115,4.0,"Thai, Restaurants",5.0,2008,1.0
84a0,Fushia Asian Bistro & Hot Pot Buffet,15317 Amberly Dr,RGTW,Tampa,33664,28.0892554,-82.4044118,4.0,"Hot Pot, Restaurants, Shanghainese, Dim Sum, Buffets, Chinese, Szechuan, Asian Fusion",5.0,2008,1.0
84f1,Olde Schoolhouse Restaurant,3419 Alt 19,IKXB,Palm Harbor,34685,28.101697,-82.772429,3.5,"Restaurants, American (Traditional)",4.0,2008,1.0
84f7,Eddie & Sam's NY Pizza,203 E Twiggs St,RGTW,Tampa,33664,27.948891,-82.459164,4.5,"Salad, Food, Pizza, Restaurants, Desserts, Ice Cream & Frozen Yogurt, Gelato",4.0,2008,1.0
84f8,Pierogi Grill,1535 Gulf To Bay Blvd,MCCU,Clearwater,33769,27.9605077111,-82.7734411527,4.0,"Polish, American (Traditional), Sandwiches, Restaurants",4.5,2008,1.0
8612,Tijuana Flats,10019 N. Dale Mabry Hwy.,RGTW,Tampa,33664,27.921907,-82.5396022,3.0,"Restaurants, Tex-Mex, Mexican",4.0,2008,1.0
863e,Tum Rub Thai,32716 US Hwy 19 N,IKXB,Palm Harbor,34685,28.0694373,-82.7409459,4.0,"Sushi Bars, Thai, Restaurants",5.0,2008,1.0
867b,Ichiban Japanese Cuisine & Sushi Bar,"2786 E Fowler Ave, Ste A",RGTW,Tampa,33664,28.0555039,-82.4273789,3.5,"Japanese, Gluten-Free, Restaurants, Asian Fusion, Sushi Bars",4.0,2008,1.0
86a3,The Original Crabby Bills,401 Gulf Blvd,SOWC,Indian Rocks Beach,33785,27.8827737,-82.850187,4.0,"Food, Seafood Markets, Seafood, Nightlife, Sandwiches, Salad, Specialty Food, Restaurants, Bars, Fish & Chips, Breakfast & Brunch",5.0,2008,1.0
86df,Five Guys Famous Burgers & Fries,13149 N Dale Mabry Hwy,RGTW,Tampa,33664,28.0660629,-82.5018964,4.0,"Burgers, Restaurants",3.0,2008,1.0
86e6,Crazy Buffet,2702 N Dale Mabry Hwy,RGTW,Tampa,33664,27.964708,-82.506439,2.5,"Asian Fusion, Restaurants, Sushi Bars, Buffets",3.3,2008,1.0
8802,Lagerhaus Brewery & Grill,3438 E Lake Business,IKXB,Palm Harbor,34685,28.0614149846,-82.7072238922,3.5,"Beer, Wine & Spirits, Food, Breweries, Pizza, Restaurants, German",4.0,2008,1.0
8803,Crab Shack Restaurant,11400 Gandy Blvd N,9EV3,San Petersburgo,33730,27.8697602,-82.6162438,3.5,"Seafood, Restaurants",2.7,2008,1.0
8808,Grass Root,4334 S Manhattan Ave,RGTW,Tampa,33664,27.902000300000005,-82.5184251,3.5,"Vegan, Restaurants, Live/Raw Food, Food, Vegetarian, Juice Bars & Smoothies",4.2,2008,1.0
8864,Cafe Kili,5731 E Fowler Ave,RGTW,Tampa,33664,28.0543048,-82.3921874,4.5,"Restaurants, Coffee & Tea, Food, Sandwiches",4.0,2008,1.0
889f,Cici's Pizza,5178 E Bay Dr,MCCU,Clearwater,33769,27.9164044,-82.7332706,2.5,"Restaurants, Pizza",2.0,2008,1.0
88ee,TJ's Italian Cafe,1515 Gulf Blvd,SOWC,Indian Rocks Beach,33785,27.8984072785,-82.8479462971,3.5,"Italian, Restaurants, Seafood, Pizza",2.5,2008,0.5
88f8,Ban Thai and Sushi Restaurant,"2519 N McMullen Booth Rd, Ste 505",MCCU,Clearwater,33769,28.0129483806,-82.7082768002,4.0,"Thai, Sushi Bars, Restaurants",2.0,2008,1.0
89f1,Sabor A Mexico,706 E Brandon Blvd,W2W7,Brandon,33511,27.938059,-82.274836,3.5,"Bars, Nightlife, Restaurants, Mexican",4.0,2008,1.0
8ac8,Sake House,5106 E Fowler Ave,RGTW,Tampa,33664,28.055212,-82.399374,3.0,"Restaurants, Sushi Bars, Japanese",4.0,2008,1.0
8bdc,BJ's Restaurant & Brewhouse,3800 Park Blvd N,SJ01,Pinellas Park,33782,27.838758,-82.68628,3.5,"Breweries, Food, Pizza, American (New), Restaurants",2.7,2008,1.0
8be5,Florida Subs & Gyros,2017 Gulf To Bay Blvd,MCCU,Clearwater,33769,27.9600935,-82.7534613,4.5,"Restaurants, Greek, Mexican, American (Traditional)",5.0,2008,1.0
8c4e,Fleming’s Prime Steakhouse & Wine Bar,4322 W Boy Scout Blvd,RGTW,Tampa,33664,27.9621936621,-82.5159262215,4.0,"Restaurants, Breakfast & Brunch, Wine Bars, Seafood, Bars, Steakhouses, Nightlife",5.0,2008,1.0
8ca8,Kojaks House of Ribs,1809 South Parsons Ave,JIN0,Seffner,33584,27.9796883,-82.2862119,4.0,"Barbeque, Restaurants",4.0,2008,1.0
8cd4,Tucson's Southwest Grill,13563 Icot Blvd,MCCU,Clearwater,33769,27.8950021,-82.7150719,3.5,Restaurants,4.0,2008,1.0
8cde,MacDinton's Soho,405 S Howard Ave,RGTW,Tampa,33664,27.9405328457,-82.4831670086,3.0,"Nightlife, Irish Pub, Sports Bars, Bars, Pubs, Irish, Restaurants",2.7,2008,1.0
8d97,China Buffet,1245 E Fowler Ave,RGTW,Tampa,33664,28.0538162,-82.4464434,2.0,"Restaurants, Chinese",3.5,2008,1.0
8da1,Los Amigos Taqueria Y Tienda,1632 Missouri Ave N,LIFE,Largo,33778,27.9318302,-82.7873945,3.5,"Mexican, Restaurants",4.0,2008,1.0
8e5e,Johnson's Barbeque,1401 W Dr Mrtn Lthr Kng Jr,7QXG,Plant City,33567,28.0115825687,-82.1377236145,4.5,"Fruits & Veggies, Barbeque, Specialty Food, Restaurants, Food",4.0,2008,1.0
8eec,Jimbo's Pit Bar B-Q - Tampa,4103 W Kennedy Blvd,RGTW,Tampa,33664,27.9451443753,-82.5122690797,3.5,"Event Planning & Services, Salad, Sandwiches, Restaurants, Caterers, Barbeque",4.5,2008,1.0
8fb5,Cha Cha Coconuts Tropical Bar & Grill,800 Second Avenue NE,9EV3,San Petersburgo,33730,27.773918,-82.622729,2.0,"Restaurants, Caribbean",2.5,2008,1.0
900b,India Grill,409 Central Ave,9EV3,San Petersburgo,33730,27.7714668,-82.6389732,3.0,"Pakistani, Restaurants, Indian",3.5,2008,1.0
90c1,Wildflower Cafe,1465 S Fort Harrison Ave,MCCU,Clearwater,33769,27.9438404,-82.7994923,4.5,"Salad, Sandwiches, Restaurants, Breakfast & Brunch",4.0,2008,1.0
9119,Gumby's Pizza and Wings,2770 University Square Dr,RGTW,Tampa,33664,28.0573437,-82.4297485,3.0,"Chicken Wings, Pizza, Restaurants",4.0,2008,1.0
920c,P J's Oyster Bar,500 1st St,SOWC,Indian Rocks Beach,33785,27.8845027,-82.8495749,3.5,"Nightlife, Seafood, Bars, Restaurants",4.3,2008,1.0
9414,Maggie Mae's Sunrise Cafe,1261 Gulf Blvd,EXHF,Clearwater Beach,33767,27.9521442258,-82.8294737702,4.0,"Restaurants, Breakfast & Brunch",4.0,2008,1.0
9456,Galerie Restaurant,3050 N Rocky Point Dr W,RGTW,Tampa,33664,27.9709476,-82.5688593,2.5,"Restaurants, American (New)",1.0,2008,0.5
9495,Mema's Alaskan Tacos,1724 E 8th Ave,RGTW,Tampa,33664,27.9611266,-82.43931860000001,3.5,"Specialty Food, Mexican, Ethnic Food, Restaurants, Food",4.1,2008,1.0
9549,Hyde Park Cafe,1806 W Platt St,RGTW,Tampa,33664,27.9416592,-82.4781736,3.0,"Pizza, Restaurants, Nightlife, Lounges, Event Planning & Services, Venues & Event Spaces, Dance Clubs, Bars",3.0,2008,1.0
959e,Red Lobster,6151 34th St N,9EV3,San Petersburgo,33730,27.82785,-82.67927,2.5,"Restaurants, American (Traditional), Seafood",3.0,2008,1.0
95a2,Greek City Cafe,3125 Commercial Way,I0WF,Spring Hill,34610,28.4764510988,-82.6139315278,4.0,"Greek, Restaurants, Food",3.0,2008,1.0
9644,Norma's Ybor City Cuban Shop,1305 E Baker St,7QXG,Plant City,33567,28.0182774,-82.1124516,4.5,"Sandwiches, Restaurants",5.0,2008,1.0
96bd,Kaiko Sushi Bar & Japanese Restaurant,"2475 N McMullen Booth Rd, Ste F",MCCU,Clearwater,33769,28.011405,-82.710931,3.5,"Sushi Bars, Japanese, Restaurants",4.0,2008,1.0
96e5,Mad Dogs & Englishmen,4115 S Macdill Ave,RGTW,Tampa,33664,27.9046781,-82.4941124,4.0,"Restaurants, British, American (New)",3.0,2008,1.0
9702,Thai Thani,615 Channelside Dr,RGTW,Tampa,33664,27.943195,-82.447127,3.5,"Restaurants, Chinese, Asian Fusion, Thai",3.0,2008,0.5
989d,Hooks Sushi Bar & Thai Food,1210 9th St N,9EV3,San Petersburgo,33730,27.7837466,-82.6468773,3.5,"Chinese, Japanese, Sushi Bars, Restaurants, Thai",3.0,2008,1.0
98dc,Pincho Y Pincho,10 Beach Dr,9EV3,San Petersburgo,33730,27.7714391,-82.6335459,4.0,"Spanish, Basque, Restaurants, Tapas Bars",4.0,2008,1.0
98ff,Zen Bistro Grill + Sushi,9620 Linebaugh Ave,RGTW,Tampa,33664,28.0428945,-82.5932128,3.5,"Sushi Bars, Restaurants, American (New), Asian Fusion, American (Traditional)",5.0,2008,1.0
9930,City Fish Grill,4022 Tampa Rd,96OP,Oldsmar,34677,28.035485,-82.654868,3.5,"American (New), Caribbean, Salad, Restaurants, Steakhouses, Seafood",4.0,2008,1.0
99b9,Campbell's Dairyland,200 S Parsons Ave,W2W7,Brandon,33511,27.935538,-82.2860151,4.0,"Ice Cream & Frozen Yogurt, Restaurants, Coffee & Tea, Fast Food, Sandwiches, Food",4.0,2008,1.0
99dc,Steak ’n Shake,1450 E Fowler Ave,RGTW,Tampa,33664,27.932189308075,-82.486521943775,2.1,"American (New), Burgers, Restaurants, Diners, American (Traditional), Breakfast & Brunch, Fast Food",3.8,2008,1.0
