id_nombre,nombre,direccion,id_ciudad,ciudad,codigo_postal,latitud,longitud,puntuacion_yelp,categories,puntuacion_usuarios,anio,analisis_sentimientos
b33a,Farmacy Vegan Kitchen + Bakery,117 N 12th St,RGTW,Tampa,33664,27.9483459238,-82.4465568171,4.0,"Food, Vegan, Bakeries, Breakfast & Brunch, Restaurants, Burgers, Juice Bars & Smoothies",5.0,2019,1.0
b344,Dunkin',1362 Commercial Way,I0WF,Spring Hill,34610,28.03600417726378,-82.61256829093385,2.0,"Donuts, Sandwiches, Food, Coffee & Tea, Bakeries, Restaurants",1.7,2019,0.5
b34e,Banyan Cafe & Catering,689-D Dr Martin Luther King Jr St N,9EV3,San Petersburgo,33730,27.779085,-82.646473,4.0,"Food, Breakfast & Brunch, Coffee & Tea, Restaurants",3.7,2019,1.0
b366,Bawarchi Biryani's,"2020 West Brandon Blvd, Ste 140",W2W7,Brandon,33511,27.92182811369,-82.35073094996001,3.5,"Food Delivery Services, Indian, Restaurants, Vegan, Food, Vegetarian, Halal",3.1,2019,1.0
b36c,Pacific Counter,660 Central Ave,9EV3,San Petersburgo,33730,27.770927,-82.642797,4.5,"Sushi Bars, Poke, Restaurants, Hawaiian, Asian Fusion, Food",4.9,2019,1.0
b36f,Juli's Restaurant,1237 Cleveland St,MCCU,Clearwater,33769,27.9654606166,-82.786096449,4.0,"Sandwiches, Mexican, Salad, Breakfast & Brunch, Restaurants",4.0,2019,1.0
b381,Gianni's Pizza,7107 Clark St,Y3QW,Hudson,34669,28.3607828,-82.6972559,4.0,"Pizza, Restaurants",4.7,2019,1.0
b386,Smiley Thai To Go,"10500 Ulmerton Rd, Ste 756",LIFE,Largo,33778,27.892975,-82.78137,4.5,"Thai, Restaurants",3.3,2019,1.0
b3a1,Cafe Bích Nga,5572 Park Blvd N,SJ01,Pinellas Park,33782,27.838968647,-82.7098303346,4.0,"Restaurants, Vietnamese, Ethnic Food, Soup, Coffee & Tea, Specialty Food, Food, Noodles",3.1,2019,1.0
b3ae,Rick's On the River,2305 N Willow Ave,RGTW,Tampa,33664,27.962838000000005,-82.473629,3.0,"Restaurants, Music Venues, American (New), Nightlife, Arts & Entertainment, Bars",3.0,2019,1.0
b3db,Madison Avenue Pizza,2660 Bayshore Blvd,L2T6,Dunedin,34698,28.0506806347,-82.7803384875,4.0,"Pizza, Restaurants, Salad, Italian",4.2,2019,1.0
b3e7,Nilsa's Puertorican Bistro,9002 N 40th St,RGTW,Tampa,33664,28.0319208,-82.4165932,3.5,"Latin American, Restaurants, Spanish, Caribbean, Puerto Rican",3.7,2019,1.0
b3fc,El Tizoncito Restaurant,1707 James L Redman Pkwy,7QXG,Plant City,33567,27.998029,-82.122827,4.5,"Restaurants, Beer Bar, Mexican, Nightlife, Chicken Wings, Bars",3.7,2019,1.0
b40c,Pizza Shack Italian Grille,11963 Indian Rocks Rd,LIFE,Largo,33778,27.8823804,-82.831938,3.5,"Italian, Restaurants, Pizza",3.4,2019,1.0
b415,San Remo's Pizzeria & Restaurant,6426 N US Hwy 41,20PF,Apollo Beach,33572,27.7708666,-82.3922161,3.5,"Restaurants, Pizza, Italian",3.7,2019,1.0
b440,Charleys Cheesesteaks,2223 N Westshore Blvd Spc FC-201,RGTW,Tampa,33664,27.963716,-82.520724,3.5,"Restaurants, Sandwiches",1.0,2019,1.0
b466,Heights Pizza,7504 N Florida Ave,RGTW,Tampa,33664,28.0163318,-82.459811,3.5,"Latin American, American (Traditional), American (New), Pizza, Restaurants, Vegetarian",3.2,2019,1.0
b470,Donatello Restaurant,232 N Dale Mabry Hwy,RGTW,Tampa,33664,27.946975,-82.5059832,4.0,"Restaurants, Italian",3.9,2019,1.0
b492,Da Sesto Italiano Ristorante e Vino,7201 66th St N,SJ01,Pinellas Park,33782,27.8382481,-82.7282048,4.5,"Food, Desserts, Wine Bars, Cocktail Bars, Bars, Nightlife, Restaurants, Event Planning & Services, Italian, Caterers",4.4,2019,1.0
b4ad,Toast-Citrus Park,8552 Gunn Hwy,L60Q,Odessa,33556,28.0860344,-82.5804111,4.0,"Breakfast & Brunch, American (New), Restaurants",4.1,2019,1.0
b4ce,Bosco's Italian To Go,30122 State Rd 54,CQ72,Wesley Chapel,33545,28.239987,-82.317939,3.5,"Restaurants, Pizza, Italian",3.2,2019,1.0
b4d2,Coffee Mill,12199 Indian Rocks Rd,LIFE,Largo,33778,27.8837395,-82.832071,4.5,"Coffee & Tea, Food, Restaurants",5.0,2019,1.0
b4ee,Bodega,1180 Central Ave,9EV3,San Petersburgo,33730,27.83986429,-82.59330488,4.5,"Spanish, Cafes, Cuban, Latin American, Juice Bars & Smoothies, Food, Coffee & Tea, Restaurants",4.6,2019,1.0
b519,Selfie Subs,12859 US Hwy 301,TC12,Riverview,33579,27.8027659,-82.3349522,4.5,"Restaurants, Breakfast & Brunch, Food, Food Trucks, Chicken Wings, Sandwiches, Cuban",4.0,2019,1.0
b51f,SOHO Juice Co.,2200 4th St N,9EV3,San Petersburgo,33730,27.86928028636364,-82.557226275,4.0,"Juice Bars & Smoothies, Restaurants, Food, Vegetarian, Acai Bowls, Vegan, Salad, Live/Raw Food",4.0,2019,1.0
b526,Fitlife Foods - Carrollwood,14407 N Dale Mabry Hwy,RGTW,Tampa,33664,28.079026,-82.50594,4.0,"Restaurants, Health Markets, Fast Food, Cafes, Food, Specialty Food",5.0,2019,1.0
b52f,Cold Stone Creamery,"100 Main St, Ste 102",B8F4,Safety Harbor,34695,27.9906145,-82.6890074,4.0,"Restaurants, Cupcakes, Ice Cream & Frozen Yogurt, Food, Custom Cakes",4.5,2019,1.0
b56b,La Ideal Sandwich Shop,2924 W Tampa Bay Blvd,RGTW,Tampa,33664,27.9739027,-82.4908853,4.0,"Restaurants, Sandwiches, Soup, Cuban",5.0,2019,0.0
b5b3,Anchor's Bar and Grille,5015 US 19 N,3IHW,New Port Richey,34655,28.2324944,-82.7317161,2.5,"Sports Bars, Nightlife, Restaurants, Tiki Bars, American (Traditional), Bars",2.5,2019,1.0
b5c6,Martin's BBQ,7036 W Waters Ave,RGTW,Tampa,33664,28.0245326716,-82.560820207,3.5,"Latin American, Restaurants, Puerto Rican, Caribbean, Barbeque, Chicken Shop",3.6,2019,1.0
b5cb,Apollo Beach Diner,6048 N US Hwy 41,20PF,Apollo Beach,33572,27.764751778,-82.3954636976,4.5,"Diners, Restaurants, Breakfast & Brunch, Sandwiches",4.9,2019,1.0
b5f0,Tyrone Restaurant,7815 38th Ave N,9EV3,San Petersburgo,33730,27.8066883,-82.7462764,4.5,"Restaurants, Breakfast & Brunch, American (New), American (Traditional), Cafes",4.7,2019,1.0
b60b,Chipotle Mexican Grill,533 S Howard Ave,RGTW,Tampa,33664,27.993437917871667,-82.54554768495208,2.4,"Mexican, Fast Food, Restaurants",2.4,2019,1.0
b61e,Mahuffer's,19201 Gulf Blvd,SOWC,Indian Rocks Beach,33785,27.8462545,-82.842041,4.0,"Barbeque, Nightlife, Food, Tiki Bars, Bars, Restaurants, Beer, Wine & Spirits, Dive Bars",3.8,2019,1.0
b623,Arco-Iris Restaurant,3328 W Columbus Dr,RGTW,Tampa,33664,27.9664178,-82.499238,4.0,"Spanish, Restaurants, Cuban",4.0,2019,1.0
b638,Golden Wok,4148 Mariner Blvd,I0WF,Spring Hill,34610,28.4910308,-82.5404283,3.5,"Restaurants, Chinese",4.5,2019,1.0
b64c,Jasmine Thai,1947 Wlumsden Rd,W2W7,Brandon,33511,27.9213164796,-82.3168221354,4.0,"Restaurants, Thai",4.4,2019,1.0
b682,Speggtacular Clearwater Beach,770 S Gulfview Blvd,MCCU,Clearwater,33769,27.9664346,-82.8227583,4.0,"Breakfast & Brunch, American (New), Restaurants",4.0,2019,1.0
b689,Rock 'N Raw,5223 N Orient Rd,RGTW,Tampa,33664,27.991867000000003,-82.372401,3.0,"Sushi Bars, Restaurants, Japanese",2.9,2019,1.0
b68a,Tin Can Cafe,307 S Myrtle Ave,MCCU,Clearwater,33769,27.96242,-82.7956614,4.5,"Cafes, Breakfast & Brunch, Restaurants",4.3,2019,1.0
b693,Hungry Harry's Famous Bar-B-Que,2006 S Parsons Ave,JIN0,Seffner,33584,27.9788551,-82.2855272,4.0,"Food, Restaurants, Desserts, Sandwiches, Salad, Barbeque",3.4,2019,1.0
b699,La Casona,5709 N Armenia Ave,RGTW,Tampa,33664,27.9994336,-82.48413830000001,3.5,"Seafood, Soup, Restaurants, Spanish, Puerto Rican, Caribbean",3.5,2019,1.0
b6b9,Saigon Deli,3858 W Waters Ave,RGTW,Tampa,33664,28.0246937978,-82.5076236703,4.5,"Vietnamese, Delis, Soup, Coffee & Tea, Food, Restaurants",4.4,2019,1.0
b6bb,Thai Lanna & Sushi,10022 Cross Creek Blvd,RGTW,Tampa,33664,28.1431929273,-82.3272731063,4.0,"Sushi Bars, Soup, Thai, Restaurants",3.6,2019,1.0
b6ed,Grillsmith - Countryside,"2539 Countryside Blvd, Ste 6",MCCU,Clearwater,33769,28.0144230995,-82.7338134329,4.0,"Breakfast & Brunch, Restaurants, Seafood, Steakhouses, Gluten-Free, Food, American (Traditional), Desserts",4.0,2019,1.0
b700,Victor's Kitchen,5571 Park Blvd,SJ01,Pinellas Park,33782,27.8395596,-82.7099067,4.5,"American (New), Breakfast & Brunch, Restaurants",4.4,2019,1.0
b702,Rumba Island Bar & Grill,1800 Gulf To Bay Blvd,MCCU,Clearwater,33769,27.97862001282052,-82.7457869179487,4.0,"Bars, Nightlife, Restaurants, Barbeque, Caribbean, Seafood",4.2,2019,1.0
b719,Palma Ceia Village Health Market,"3225 S Macdill Ave, Ste 123",RGTW,Tampa,33664,27.916039,-82.494609,4.5,"Vegetarian, Juice Bars & Smoothies, Food, Shopping, Restaurants, Vitamins & Supplements, Specialty Food",5.0,2019,1.0
b73b,Ricopan Bakehouse,8302 Causeway Blvd,RGTW,Tampa,33664,27.923046866,-82.36344885079998,4.5,"Colombian, Bakeries, Latin American, Desserts, Imported Food, Restaurants, Specialty Food, Ethnic Food, Food",4.6,2019,1.0
b744,BubbaQue's,957 E Brandon Blvd,W2W7,Brandon,33511,27.8063236981,-82.33445801492549,4.0,"American (New), Barbeque, Local Flavor, Sandwiches, Restaurants, American (Traditional)",4.5,2019,1.0
b752,Tibby's New Orleans Kitchen,1721 W Brandon Blvd,W2W7,Brandon,33511,27.9370899,-82.3113325,4.0,"Desserts, Salad, Cajun/Creole, Food, Restaurants",4.1,2019,1.0
b755,Big Storm Brewery - Odessa,2330 Success Dr,L60Q,Odessa,33556,28.192732,-82.625587,4.5,"Bars, Nightlife, Beer Bar, Restaurants, Breweries, Food",3.5,2019,1.0
b75a,Mangia Bene Pizzeria,"1811 N 15th St, Ste D",RGTW,Tampa,33664,27.9607259,-82.4427861,2.5,"Pizza, Restaurants",2.4,2019,0.5
b777,The Surly Mermaid,,9EV3,San Petersburgo,33730,27.7480089,-82.6645469,4.5,"Food, Seafood, American (Traditional), Burgers, Fish & Chips, Restaurants, Food Trucks, Sandwiches",4.5,2019,1.0
b787,Fiesta Taqueria,"1479 Belcher Rd, Ste B",LIFE,Largo,33778,27.9035372,-82.74570309999999,4.5,"Mexican, Restaurants",4.5,2019,1.0
b78b,Chiang Mai Thai & Sushi Bar,415 Cleveland St,MCCU,Clearwater,33769,27.965343,-82.800563,3.5,"Restaurants, Thai, Sushi Bars",3.7,2019,1.0
b790,Palm Avenue Sandwich Shop,2002 N Nebraska Ave,RGTW,Tampa,33664,27.9625853,-82.4515743,4.0,"Sandwiches, Restaurants",4.0,2019,1.0
b7a3,Acropol Inn Restaurant,2552 Sunset Pt Rd,MCCU,Clearwater,33769,27.9912391,-82.7313785,4.0,"Greek, Restaurants",4.4,2019,1.0
b804,Rick's Italiano Meats & N.Y. Style Pizza,905 Klosterman Rd,3IGC,Tarpon Springs,34689,28.075340856375,-82.6230598868125,3.9,"Pizza, Restaurants, Italian",3.0,2019,1.0
b81e,taqueria la cañada,1500 N Parsons Ave,W2W7,Brandon,33511,27.9636945,-82.2863969,5.0,"Food, Food Trucks, Tacos, Mexican, Restaurants",5.0,2019,1.0
b823,Ithai & Sushi Restaurant,11002 Seminole Blvd,LIFE,Largo,33778,27.8730288,-82.7875025,4.0,"Restaurants, Thai, Sushi Bars",4.2,2019,1.0
b857,Island Fin Poké,"6417 E County Line Rd, Ste 101",RGTW,Tampa,33664,28.169016,-82.356628,5.0,"Gluten-Free, Poke, Food, Restaurants, Hawaiian",4.7,2019,1.0
b874,Blue Sake,1425 Main St,L2T6,Dunedin,34698,28.0188334413,-82.7666660026,4.0,"Restaurants, Sushi Bars, Asian Fusion, Japanese, Food, Thai",4.0,2019,1.0
b888,Sultans Sweets,Bush Gardens,RGTW,Tampa,33664,28.032675,-82.425695,2.0,"Food, Restaurants, American (Traditional), Bakeries",3.0,2019,0.5
b895,Pearly's Beach Eats,45 Papaya St,MCCU,Clearwater,33769,27.984336088903262,-82.82055075353007,4.4,"American (Traditional), Mexican, Restaurants, Local Flavor, Burgers, Sandwiches, Seafood, Salad, American (New), Tacos",4.4,2019,1.0
b898,Pho Kien Giang,8730 49th St N,SJ01,Pinellas Park,33782,27.8518584,-82.7006277,4.5,"Soup, Vietnamese, Sandwiches, Restaurants",4.3,2019,1.0
b8a5,Capo De Monte Italian Market,8400 Seminole Blvd,8ZKX,Seminole,33777,27.848991800000004,-82.7875867,4.5,"Italian, Grocery, Restaurants, Delis, Event Planning & Services, Food, Beer, Wine & Spirits, Specialty Food, Caterers",3.7,2019,1.0
b8b8,Robert's Smokin' BBQ,"7810 US 19, Bldg B",9LT4,Port Richey,34668,28.270942575,-82.7239409729,4.5,"Event Planning & Services, Restaurants, Caterers, Barbeque, Southern",4.7,2019,1.0
b8c5,Grandma Sally's,5330 Grand Blvd,3IHW,New Port Richey,34655,28.2369459,-82.7214459,4.0,"Restaurants, American (Traditional), Breakfast & Brunch",5.0,2019,1.0
b8ce,Pomodoro Pizza,"27607 State Road 56, Ste 105",CQ72,Wesley Chapel,33545,28.1864331,-82.359882,4.0,"Restaurants, Pizza, Italian, Seafood",4.1,2019,1.0
b8d3,Señor Tequila Mexican Restaurant - Tampa,11115 N Dale Mabry Hwy,RGTW,Tampa,33664,28.050129822,-82.5031507015,4.0,"Bars, Mexican, Seafood, Restaurants, Nightlife",4.0,2019,1.0
b8db,Bobby's Bistro & Wine Bar,447 Mandalay Ave,EXHF,Clearwater Beach,33767,27.980152503,-82.8268117048,3.5,"American (New), Restaurants, Nightlife, Wine Bars, Bars",4.7,2019,1.0
b8ee,Azteca Rojo,"5831 Memorial Hwy, Ste A",RGTW,Tampa,33664,27.9845472,-82.5688359,5.0,"Mexican, Restaurants",4.8,2019,1.0
b90a,Country Pizza Italian Grill,14820 US Hwy 19 N,MCCU,Clearwater,33769,27.9073152,-82.7300051,4.0,"Pizza, Italian, Restaurants",3.7,2019,1.0
b922,Islands Pizza,235 E Davis Blvd,RGTW,Tampa,33664,27.9266251,-82.4530508,3.0,"Restaurants, Nightlife, Bars, Pizza, Sports Bars",2.7,2019,1.0
b95c,Hamburger Marys,2901 Tyrone Blvd N,9EV3,San Petersburgo,33730,27.7975851,-82.7343122,3.5,"Burgers, Bars, Adult Entertainment, Restaurants, Cabaret, Arts & Entertainment, Nightlife",2.2,2019,0.5
b96a,Olive The World Bistro,24 Hibiscus St,3IGC,Tarpon Springs,34689,28.146553,-82.7561386,4.5,"Tapas/Small Plates, Salad, Desserts, Italian, Brasseries, Restaurants, Food, Specialty Food, Coffee & Tea",4.6,2019,1.0
b975,Sbarro,253 Westshore Plz,RGTW,Tampa,33664,27.9472253,-82.5276699,3.5,"Restaurants, Italian",5.0,2019,1.0
b998,City Dog Cantina,"1208 E Kennedy Blvd, Ste 114",RGTW,Tampa,33664,27.9511531167,-82.4474879598,3.0,"Breakfast & Brunch, Diners, American (Traditional), Restaurants, Mexican",3.0,2019,1.0
b9a3,Ricks Pizza Of Palm Harbor,31808 US Hwy 19 N,IKXB,Palm Harbor,34685,28.061511,-82.7397399,4.0,"Restaurants, Pizza",4.5,2019,1.0
b9ad,Boston's Restaurant & Sports Bar,9316 Anderson Road,RGTW,Tampa,33664,28.0345574,-82.5421367,3.5,"Sports Bars, American (New), Restaurants, Nightlife, Bars, Pizza",5.0,2019,1.0
b9b3,Villa Bellini Restaurant & Lounge,2930 Gulf To Bay Blvd,MCCU,Clearwater,33769,27.9610325,-82.7160438,3.5,"Italian, Nightlife, Lounges, Restaurants, Bars",3.9,2019,1.0
b9dc,Jimmy's On The Edge,"505 S Gulfview Blvd, Fl 10",MCCU,Clearwater,33769,27.9683437591,-82.8284510816,3.5,"Pubs, Lounges, Cocktail Bars, American (Traditional), Restaurants, Nightlife, Breakfast & Brunch, Bars",3.1,2019,1.0
b9df,Hot Tuna Sushi Bar & Grille,"3689 Tampa Rd, Ste 302B",96OP,Oldsmar,34677,28.045019,-82.68082,4.5,"Restaurants, Sushi Bars, Japanese",4.4,2019,1.0
b9e4,Outback Steakhouse,10860 State Rd 54,3IHW,New Port Richey,34655,27.98302914354945,-82.52325829117979,3.2,"Restaurants, Steakhouses",3.4,2019,1.0
ba25,Willie Jewell's Old School Bar-B-Q,"7724 113th St, Ste D",8ZKX,Seminole,33777,27.938067772944,-82.68289876698,3.5,"Southern, Sandwiches, Barbeque, Restaurants",3.9,2019,1.0
ba26,Krispy Krab 2,7107 N Nebraska Ave,RGTW,Tampa,33664,28.0127372751,-82.4510699138,4.0,"Seafood, Restaurants",3.9,2019,1.0
ba3f,El Texano,35903 US Hwy 19 N,IKXB,Palm Harbor,34685,28.0988387466,-82.7391817658,3.0,"Mexican, Restaurants",2.7,2019,1.0
ba65,Twistee Treat - Tarpon Springs,905 E Tarpon Ave,3IGC,Tarpon Springs,34689,28.1466214,-82.7422052,3.5,"Hot Dogs, Restaurants, Desserts, Ice Cream & Frozen Yogurt, Food, Juice Bars & Smoothies",1.5,2019,1.0
ba74,Yankee Bean,901 S Pinellas Ave,3IGC,Tarpon Springs,34689,28.139333000000004,-82.7563106,4.5,"Wraps, Sandwiches, Salad, Restaurants, Soup",4.3,2019,1.0
ba7d,Malio's Prime Steakhouse,400 N Ashley Dr,RGTW,Tampa,33664,27.9475496003,-82.4602517705,3.5,"Steakhouses, Restaurants",3.7,2019,1.0
ba8c,Fiddlers Green Irish Pub & Eatery,7813 Mitchell Blvd,3IHW,New Port Richey,34655,28.1876668,-82.6852593,3.5,"Restaurants, Irish, American (Traditional)",2.4,2019,0.5
ba95,Booming Express,5012 US19 N,3IHW,New Port Richey,34655,28.2321872711,-82.7299499512,2.5,"Restaurants, Chinese, Soup, Seafood",2.8,2019,1.0
babe,Fred's Southern Kitchen,1401 W Dr Martin Luther King Blvd,7QXG,Plant City,33567,28.0115175,-82.1368103,4.5,"Restaurants, Buffets, Southern",4.3,2019,1.0
bad3,World of Beer,5311 Avion Park Dr,RGTW,Tampa,33664,27.97334923829787,-82.46032533687944,3.8,"Bars, American (Traditional), Restaurants, Pubs, Nightlife",3.9,2019,1.0
badd,Old Earth Pure ORGANIC Food,6105 54th Ave N,9EV3,San Petersburgo,33730,27.821238000000005,-82.718205,5.0,"Salad, Live/Raw Food, Vegan, Health Markets, Juice Bars & Smoothies, Restaurants, Specialty Food, Food",5.0,2019,1.0
bae4,Southern Fresh,122 3rd Ave N,B8F4,Safety Harbor,34695,27.9912075003,-82.6899860688,4.5,"Food, Southern, Restaurants",4.0,2019,1.0
baf2,Top Slice Pizzeria,21 3rd St N,9EV3,San Petersburgo,33730,27.771722,-82.63691,4.0,"Restaurants, Pizza",3.6,2019,1.0
bb08,Tampa Palms Golf & Country Club,5811 Tampa Palms Blvd,RGTW,Tampa,33664,28.0951004911,-82.3912887021,3.0,"Venues & Event Spaces, Country Clubs, Active Life, Arts & Entertainment, Restaurants, Tennis, Event Planning & Services, Golf, Swimming Pools",2.0,2019,1.0
bb09,Thee Tree House,1809 W Platt St,RGTW,Tampa,33664,27.9419985,-82.4785544,4.0,"American (New), Nightlife, Bars, Breakfast & Brunch, Restaurants",3.8,2019,1.0
bb21,Sunsets Restaurant,18430 Livingston Ave,1GQ7,Lutz,33559,28.1419259765,-82.4307380827,3.5,"Breakfast & Brunch, American (Traditional), Restaurants, Southern, Barbeque",2.9,2019,1.0
bb31,The Stadium,2349 7 Springs Blvd,3IHW,New Port Richey,34655,28.193679499999995,-82.6995764,3.5,"Bars, American (Traditional), Restaurants, Sports Bars, Nightlife",3.0,2019,1.0
bb3f,Tacos El Borracho,,RGTW,Tampa,33664,27.9444959961,-82.4867698254,4.0,"Food Trucks, Food, Restaurants, Tacos, Street Vendors, Mexican",3.9,2019,1.0
bb58,Sofia's Greek Grill,1446 Belcher Rd S,MCCU,Clearwater,33769,27.943739000000004,-82.746418,4.5,"Burgers, Salad, Greek, Restaurants",4.6,2019,1.0
bb5d,Pupuseria & Cafeteria Centroamericana,2504 W Martin Luther King Blvd,RGTW,Tampa,33664,27.9809251,-82.4855927,4.5,"Latin American, Restaurants, Salvadoran",4.6,2019,1.0
bb89,Grain and Berry,1155 S Dale Mabry Hwy,RGTW,Tampa,33664,27.9324458774,-82.5070745308,4.0,"Vegan, Food, Restaurants, Acai Bowls, Juice Bars & Smoothies",4.5,2019,1.0
bbcb,Nickel's Diner,6403 Massachusetts Ave,3IHW,New Port Richey,34655,28.2591306,-82.7088466,4.0,"Restaurants, Diners, Greek",3.0,2019,0.5
bbd8,Copenhagen Cafe,15 N Pinellas Ave,3IGC,Tarpon Springs,34689,28.146636,-82.756769,4.5,"Coffee & Tea, Chocolatiers & Shops, Gelato, Food, Breakfast & Brunch, Desserts, Restaurants, Specialty Food",4.9,2019,1.0
bbdb,Al's Finger Licking Good Soul Food,2302 E 7th Ave,RGTW,Tampa,33664,27.9604016094,-82.4333611028,4.5,"Restaurants, Soul Food",4.4,2019,1.0
bbe0,WEPA Cocina de Puerto Rico,"2149 3rd Ave S, Ste 6, Entrance on 22nd Street South",9EV3,San Petersburgo,33730,27.7685388,-82.6628724,4.0,"Caribbean, Puerto Rican, Latin American, Restaurants",4.0,2019,1.0
bbf6,Cigar City Brewing,4100 George J Bean Pkwy,RGTW,Tampa,33664,27.976725964,-82.5377468,3.0,"Cuban, Food, Airports, Restaurants, Breweries, Hotels & Travel, Tours",3.5,2019,1.0
bbfa,Kay's Kitchen,11124 N 30th St,RGTW,Tampa,33664,28.0494291,-82.4267122,4.5,"Restaurants, Fish & Chips, Food Trucks, Food, Sandwiches, Chicken Wings, Pizza, Comfort Food",4.6,2019,1.0
bc01,Times Square Pizza Company,927 E Bloomingdale Ave,W2W7,Brandon,33511,27.8937241,-82.2695446,3.5,"Food, Restaurants, Pizza, Desserts, Salad, Italian",4.0,2019,1.0
bc0c,Rollin' Oats Market & Cafe,1021 N Macdill Ave,RGTW,Tampa,33664,27.9529376,-82.4924656,4.5,"Food, Health Markets, Restaurants, Organic Stores, Specialty Food, Grocery, Juice Bars & Smoothies, Cafes",5.0,2019,1.0
bc12,International Beer Garten,"16540 Pointe Village Dr, Ste 102",1GQ7,Lutz,33559,28.1894162291,-82.5406694412,3.0,"Breweries, Pubs, Bars, Restaurants, Food, Beer, Wine & Spirits, Nightlife",2.3,2019,1.0
bc24,PJs Brick Oven Pizza - Spring Hill,2144 Mariner Blvd,I0WF,Spring Hill,34610,28.4632586248,-82.5404441357,3.5,"Pizza, Food Delivery Services, Restaurants, Specialty Food, Salad, Pasta Shops, Food",3.5,2019,1.0
bc41,Latin Grill  - Brandon,3318 John Moore,W2W7,Brandon,33511,27.8939445425,-82.2855443933,3.5,"Restaurants, Cuban, Spanish, Food, Latin American",3.8,2019,1.0
bc50,MOD Pizza,2227 Sun Vista Dr,1GQ7,Lutz,33559,28.190794,-82.395553,4.0,"Pizza, Fast Food, Restaurants",4.1,2019,1.0
bc6a,Hog Island Fish Camp,900 Broadway Ave,L2T6,Dunedin,34698,28.0137265258,-82.7899396468,4.0,"Seafood, Restaurants",4.0,2019,1.0
bc9e,Dockside Grille,5015 US-19,3IHW,New Port Richey,34655,28.231831600000003,-82.7300949,2.5,"American (Traditional), American (New), Sports Bars, Nightlife, Dance Clubs, Venues & Event Spaces, Restaurants, Tiki Bars, Event Planning & Services, Bars, Karaoke",1.5,2019,0.5
bca8,Claudia's Heavenly Flans and Cakes,21957 US 19 N,MCCU,Clearwater,33769,27.9720283,-82.726963,5.0,"Bakeries, Sandwiches, Restaurants, Food, Custom Cakes, Cupcakes, Desserts, Food Delivery Services",5.0,2019,1.0
bcb4,Apps & Tapps Trinity,"10700 State Road 54, Ste 101",3IHW,New Port Richey,34655,28.1933101649,-82.6380192238,2.5,"Nightlife, Sports Bars, Tacos, Mexican, Restaurants, American (New), Bars",2.7,2019,1.0
bcce,Ohana Mediterranean Eatery,2543-4 Countryside Blvd,MCCU,Clearwater,33769,28.0126242,-82.7323941,5.0,"Restaurants, Hookah Bars, Mediterranean, Bars, Nightlife",4.8,2019,1.0
bccf,Eastern Buffet Chinese Dishes Fresh Seafood & Sushi Bar,"1707 James L Redman Pkwy, Ste G",7QXG,Plant City,33567,27.9979018,-82.1228654,2.5,"Chinese, Sushi Bars, Buffets, Restaurants",3.0,2019,1.0
bcd1,Poblanos Mexican Grill & Bar,2451 N McMullen Booth Rd,MCCU,Clearwater,33769,28.0104334843,-82.7098818788,3.0,"Ethnic Food, Specialty Food, Food, Mexican, Restaurants",2.9,2019,1.0
bcee,WalkAbout Bakery & Eatery,18430 Livingston Ave,1GQ7,Lutz,33559,28.141866,-82.4308822,4.5,"Cafes, Food, Restaurants, Bakeries, Australian",4.2,2019,1.0
bcf0,Tacos Piki,115 E Reynolds St,7QXG,Plant City,33567,28.0162296782,-82.1232137829,4.5,"Tacos, Restaurants, Mexican",4.2,2019,1.0
bd01,Season's Fresh,2816 E Bearss Ave,RGTW,Tampa,33664,28.0812683681,-82.4279611613,4.5,"Modern European, American (New), Farmers Market, Cafes, Restaurants, American (Traditional), Breakfast & Brunch, Food",5.0,2019,1.0
bd33,Philly's Famous Cheese Steaks,4375 E Bay Dr,MCCU,Clearwater,33769,27.91601,-82.7414677,3.0,"Pizza, Cheesesteaks, Restaurants, Sandwiches",3.2,2019,1.0
bd52,Bulla Gastrobar,930 S Howard Ave,RGTW,Tampa,33664,27.934214,-82.4829037,4.0,"Tapas/Small Plates, Gastropubs, Restaurants, Spanish, Tapas Bars, Mediterranean",4.3,2019,1.0
bd54,Chick-N-Bones Cafe & Catering,1953 W Lumsden Rd,W2W7,Brandon,33511,27.921235,-82.316928,4.0,"Barbeque, Restaurants, Sandwiches",4.4,2019,1.0
bd58,20th Hole Bar & Grill,8342 New York Ave,Y3QW,Hudson,34669,28.3747192,-82.6765444,3.0,"Bars, Active Life, Restaurants, Golf, Nightlife, American (Traditional)",1.8,2019,0.5
bd7d,Chopsticks Super Buffet,"2543 Countryside Blvd, Ste 1",MCCU,Clearwater,33769,28.0126242,-82.7323941,3.0,"Restaurants, Buffets, Chinese",3.0,2019,1.0
bd94,China One of Pinellas Park,7675 49th St N,SJ01,Pinellas Park,33782,27.8415543,-82.6991235,2.5,"Restaurants, Chinese",2.5,2019,1.0
bdd2,Frontier Steakhouse,8602 E Sligh Ave,RGTW,Tampa,33664,28.0114286,-82.3605699,3.5,"Burgers, Steakhouses, Restaurants, American (Traditional)",2.3,2019,1.0
bde3,Mekenita Cantina,6707 N Florida Ave,RGTW,Tampa,33664,28.008181933558763,-82.45746168899794,4.0,"Food, Restaurants, Mexican",4.4,2019,1.0
bde5,Mata’s Philippine Cuisine,"4350 W Waters Ave, Ste 102",RGTW,Tampa,33664,28.0250178,-82.5166075,4.0,"Restaurants, Fast Food, Filipino",4.3,2019,1.0
bdef,Clear Sky Draught Haus,680 Main St,L2T6,Dunedin,34698,28.0156064648,-82.782739965,4.0,"Restaurants, Sports Bars, Bars, American (New), Burgers, American (Traditional), Gastropubs, Breakfast & Brunch, Nightlife",4.3,2019,1.0
bdf0,Potbelly Sandwich Shop,"4100 George J Bean Pkwy, Tampa Intl. Airport, Tampa Intl Airport",RGTW,Tampa,33664,27.9751298905,-82.53224,3.0,"Soup, Restaurants, Sandwiches, Fast Food, Breakfast & Brunch, Salad",3.1,2019,1.0
bdfe,Chili's,3701 Tampa Rd,96OP,Oldsmar,34677,28.04513805889044,-82.53846992807131,2.7,"Bars, American (Traditional), Tex-Mex, Restaurants, Nightlife",2.6,2019,1.0
be03,Crazy Burrito,2506 W Columbus Dr,RGTW,Tampa,33664,27.9664862,-82.4854919,4.0,"Mexican, Restaurants",4.0,2019,1.0
be25,Leo's Italian Grill,33286 US 19 N,IKXB,Palm Harbor,34685,28.0747837,-82.7395336,2.5,"Italian, Restaurants",2.9,2019,1.0
be31,Sea Sea Riders Restaurant,221 Main St,L2T6,Dunedin,34698,28.01201,-82.790703,3.0,"Nightlife, Restaurants, Bars, Seafood",3.6,2019,1.0
be36,Tacos Mi Rancho,10319 Dale Mabry,RGTW,Tampa,33664,28.044055,-82.504372,4.5,"Food Trucks, Restaurants, Food, Mexican",4.2,2019,1.0
be44,Gold Ring Cafe,2510 N Tampa St,RGTW,Tampa,33664,27.9665649,-82.4611651,4.0,"Event Planning & Services, Seafood, Restaurants, Latin American, Spanish, Cuban, Caterers",5.0,2019,1.0
be49,Babalu,9246 4th St N,9EV3,San Petersburgo,33730,27.8563458,-82.6391062,3.0,"Nightlife, Burgers, Bars, American (Traditional), Restaurants",2.0,2019,1.0
be53,Hank's Catfish & BBQ,8546 N Dale Mabry Hwy,RGTW,Tampa,33664,28.028341699999995,-82.5055852,3.5,"Restaurants, Southern, Barbeque",3.3,2019,1.0
be5f,Crazy Burrito - Dunedin,"1140 Main St, Unit 2 & 3",L2T6,Dunedin,34698,28.019495,-82.774431,4.5,"Restaurants, Mexican",4.4,2019,1.0
be69,Rise Kitchen & Bakery,5223 Orient Rd,RGTW,Tampa,33664,27.9916829,-82.3723871,3.0,"Food, Restaurants, Sandwiches, Bakeries, Coffee & Tea",1.5,2019,1.0
be74,The Ozona Pig,311 Orange St,IKXB,Palm Harbor,34685,28.0693234,-82.776405,4.0,"Barbeque, Bars, Food, Seafood, Southern, Restaurants, Breakfast & Brunch, Desserts, Gay Bars, Nightlife, American (New), Chicken Wings",3.8,2019,1.0
bece,Della's Cafe & Bistro,608 Oakfield Dr,W2W7,Brandon,33511,27.9346427626,-82.2918930029,4.0,"Nightlife, Arts & Entertainment, Mediterranean, French, Jazz & Blues, American (New), Breakfast & Brunch, Cafes, Italian, Restaurants, Sandwiches",4.6,2019,1.0
bee3,Deccan Spice,"2325 Ulmerton Rd, Ste 28",MCCU,Clearwater,33769,27.8944003,-82.6674843,4.0,"Nightlife, Venues & Event Spaces, Indian, Bars, Buffets, Restaurants, Lounges, Soup, Event Planning & Services, Salad",3.5,2019,1.0
